recipe_link,name,prep,cook,additional,total,servings,yield,ingredients,instructions,nutrition
https://www.allrecipes.com/recipe/233372/sarahs-ambrosia-fruit-salad/,Sarah's Ambrosia Fruit Salad Recipe,15 mins,,2 hrs,2 hrs 15 mins,10,10 servings,"3 (20 ounce) cans pineapple tidbits, drained, 4 (15 ounce) cans mandarin oranges, drained, 1 (16 ounce) container sour cream, 1 (10.5 ounce) package miniature marshmallows, ¾ cup shredded coconut, or to taste","Mix pineapple, oranges, sour cream, marshmallows, and coconut together in a bowl. Cover bowl with plastic wrap and refrigerate until flavors blend, 2 hours to overnight.",393 calories; protein 3.4g; carbohydrates 72.1g; fat 11.3g; cholesterol 20mg; sodium 87.3mg.
https://www.allrecipes.com/recipe/214924/farro-salad-with-asparagus-and-parmesan/,Farro Salad with Asparagus and Parmesan,20 mins,55 mins,12 hrs,13 hrs 15 mins,12,12 servings,"2 cups farro, ¾ pound fresh asparagus, trimmed, 1 cup red and yellow cherry tomatoes, halved, ¾ cup chopped walnuts, ¾ cup dried cranberries, ½ cup chopped fresh parsley, ⅓ cup chopped fresh chives, ¼ cup balsamic vinaigrette, or to taste, 1 cup shaved Parmesan cheese, divided","Soak farro in a large bowl of water for at least 12 hours. Drain. Fill a large pot with lightly salted water and bring to a rolling boil over high heat. Once the water is boiling, stir in the drained farro, and return to a boil. Reduce heat to medium, then cook the farro uncovered, stirring occasionally for 20 minutes. Reduce heat to low, cover, and continue simmering until tender, about 30 more minutes. Drain and allow to cool. Bring a large pot of lightly salted water to a boil. Add the asparagus, and cook uncovered until tender, about 3 minutes. Drain in a colander, then immediately immerse in ice water for several minutes until cold to stop the cooking process. Once the asparagus is cold, drain well, and chop. Set aside. Place farro, asparagus, tomatoes, walnuts, cranberries, parsley, and chives in a large bowl. Drizzle the balsamic vinaigrette over and sprinkle about 3/4 cups Parmesan cheese, then toss. Top with the remaining 1/4 cup of Parmesan cheese. Serve at room temperature.",223 calories; protein 7.9g; carbohydrates 32.4g; fat 9.1g; cholesterol 5.9mg; sodium 164.4mg.
https://www.allrecipes.com/recipe/267974/my-big-fat-greek-salad/,My Big Fat Greek Salad Recipe,20 mins,,50 mins,1 hr 10 mins,4,4 servings,"2 large English cucumbers, 1 pinch kosher salt, 2 cups cherry tomatoes, ¼ red onion, ½ red bell pepper, ½ cup pitted Kalamata olives, ½ cup pitted green olives, 2 tablespoons minced fresh oregano, salt and freshly ground black pepper to taste, 1 pinch cayenne pepper, or to taste, ¼ cup red wine vinegar, or to taste, ⅓ cup olive oil, or to taste, 1 (4 ounce) package feta cheese, diced, divided, 1 teaspoon minced fresh oregano, or to taste","Peel off a few strips of cucumber skin using a channel knife, creating a striped pattern. Cut cucumbers in half crosswise. Cut each half into quarters before cutting into 1/4- to 1/2-inch slices. Place into a colander; toss with some kosher salt and let sit for 10 to 15 minutes. Meanwhile, cut cherry tomatoes in half. Rinse cucumbers; drain thoroughly for 10 to 15 minutes more. While cucumbers are draining, slice onion thinly. Cut bell pepper into strips. Turn knife diagonally and cut strips into diamond-shaped pieces. Slice Kalamata and green olives. Combine cucumbers, tomatoes, onion, bell pepper, olives, and 2 tablespoons oregano in a bowl. Season with salt, black pepper, and cayenne. Sprinkle in vinegar and toss thoroughly. Drizzle in olive oil. Add about 2/3 of the feta cheese and toss again. Cover with plastic wrap and refrigerate for 30 to 60 minutes. Give the salad another mix. Taste and season as desired. Scatter remaining feta cheese on top and garnish with remaining oregano.",352 calories; protein 6.3g; carbohydrates 12.9g; fat 31.8g; cholesterol 25.1mg; sodium 1249.9mg.
https://www.allrecipes.com/recipe/232864/potato-salad/,Potato Salad Recipe,20 mins,10 mins,6 hrs,6 hrs 30 mins,20,20 servings,"5 pounds red potatoes, chopped, 3 cups mayonnaise, 2 cups finely chopped pickles, 5 hard-cooked eggs, chopped, ½ cup chopped red onion, ½ cup chopped celery, 3 tablespoons prepared mustard, 1 tablespoon apple cider vinegar, 1 teaspoon salt, or to taste, ½ teaspoon ground black pepper","Place potatoes into a large pot and cover with salted water; bring to a boil. Reduce heat to medium-low and simmer until tender, about 10 minutes. Drain. Return potatoes to empty pot to dry while you mix the dressing. Sprinkle with salt. Stir mayonnaise, pickles, hard-cooked eggs, red onion, celery, mustard, cider vinegar, 1 teaspoon salt, and pepper together in a large bowl. Fold potatoes into the mayonnaise mixture. Allow to chill at least six hours, or overnight, before serving.",339 calories; protein 4.1g; carbohydrates 20.4g; fat 27.6g; cholesterol 53.5mg; sodium 538.1mg.
https://www.allrecipes.com/recipe/16080/judys-strawberry-pretzel-salad/,Judy's Strawberry Pretzel Salad Recipe,15 mins,10 mins,1 hr 35 mins,2 hrs,16,16 servings,"1 ½ cups crushed pretzels, 4 ½ tablespoons white sugar, ¾ cup butter, melted, 1 cup white sugar, 2 (8 ounce) packages cream cheese, 1 (8 ounce) container frozen whipped topping, thawed, 1 (6 ounce) package strawberry flavored Jell-O®, 2 cups boiling water, 1 (16 ounce) package frozen strawberries","Preheat oven to 350 degrees F (175 degrees C). Mix together the pretzels, 4 1/2 tablespoons sugar and melted butter. Press into the bottom of a 9x13 inch pan. Bake for 10 minutes, or until lightly toasted. Set aside to cool completely. In a medium bowl, beat the sugar and cream cheese until smooth. Fold in whipped topping. Spread evenly over the cooled crust. Refrigerate until set, about 30 minutes. In a medium bowl, stir together the gelatin mix and boiling water. Mix in frozen strawberries, and stir until thawed. Pour over cream cheese mixture in pan. Refrigerate until completely chilled, at least 1 hour.",371 calories; protein 4.2g; carbohydrates 41.2g; fat 22.3g; cholesterol 53.7mg; sodium 327.2mg.
https://www.allrecipes.com/recipe/14276/strawberry-spinach-salad-i/,Strawberry Spinach Salad Recipe,10 mins,,1 hr 10 mins,1 hr 20 mins,4,,"½ cup white sugar, ½ cup olive oil, ¼ cup distilled white vinegar, 2 tablespoons sesame seeds, 1 tablespoon poppy seeds, 1 tablespoon minced onion, ¼ teaspoon paprika, ¼ teaspoon Worcestershire sauce, 1 quart strawberries - cleaned, hulled and sliced, 10 ounces fresh spinach - rinsed, dried and torn into bite-size pieces, ¼ cup almonds, blanched and slivered","Make dressing: Whisk together sugar, oil, vinegar, sesame seeds, poppy seeds, onion, paprika, and Worcestershire in a medium bowl. Cover and chill for 1 hour. Make salad: Combine strawberries, spinach, and almonds in a large bowl. Pour dressing over salad; toss to coat. Refrigerate for 10 to 15 minutes before serving.",491 calories; protein 6g; carbohydrates 42.9g; fat 35.2g; sodium 62.9mg.
https://www.allrecipes.com/recipe/237723/chef-johns-green-goddess-dressing/,Chef John's Green Goddess Dressing Recipe,15 mins,,,15 mins,16,16 servings,"1 cup mayonnaise, ¾ cup sour cream, ⅓ cup chopped fresh flat-leaf parsley, ⅓ cup chopped fresh tarragon, ¼ cup chopped fresh chives, 2 tablespoons fresh lemon juice, or more to taste, 1 tablespoon rice vinegar, 1 anchovy fillet, 1 clove garlic, chopped, 1 pinch cayenne pepper, or to taste, salt and freshly ground black pepper to taste","Blend mayonnaise, sour cream, parsley, tarragon, chives, lemon juice, rice vinegar, anchovy fillet, garlic, cayenne pepper, salt, and black pepper in a blender until smooth.",124 calories; protein 0.7g; carbohydrates 1.3g; fat 13.2g; cholesterol 10.2mg; sodium 103.5mg.
https://www.allrecipes.com/recipe/236863/grilled-hearts-of-romaine/,Grilled Hearts of Romaine,10 mins,5 mins,,15 mins,6,6 servings,"3 romaine lettuce hearts, halved lengthwise, 1 tablespoon olive oil, divided, or as needed, 2 tablespoons freshly grated Parmigiano-Reggiano cheese, or to taste, 2 tablespoons balsamic vinegar, or to taste, 2 tablespoons sherry vinegar, or to taste, 2 tablespoons olive oil, or to taste","Preheat an outdoor grill for high heat, and lightly oil the grate. Brush each romaine lettuce half with 1/2 teaspoon olive oil. Cook romaine hearts, cut-side down, on the preheated grill until the cut-side is slightly caramelized but the inside is still cool and crisp, about 2 minutes. Transfer lettuce, cut-side up, to a platter. Sprinkle Parmigiano-Reggiano cheese over lettuce and drizzle balsamic vinegar, sherry vinegar, and 2 tablespoons olive oil over the top.",88 calories; protein 1.9g; carbohydrates 4.2g; fat 7.5g; cholesterol 1.5mg; sodium 35.2mg.
https://www.allrecipes.com/recipe/244262/vincents-famous-garlic-coleslaw/,Vincent's Famous Garlic Coleslaw Recipe,15 mins,,1 hr,1 hr 15 mins,8,8 servings,"1 medium head green cabbage, finely shredded, 3 tablespoons finely chopped garlic, 1 ½ teaspoons kosher salt, ⅓ cup grapeseed oil, ⅓ cup mayonnaise, ⅓ cup apple cider vinegar, ¼ teaspoon ground paprika, ¼ teaspoon ground white pepper, ⅛ teaspoon white sugar, ⅛ teaspoon celery seed","Place shredded cabbage into a large bowl. Gather chopped garlic into a mound on a cutting board and pour salt over top. Using the flat side of a chef's knife, smash the garlic and salt together and transfer to a bowl. Whisk grapeseed oil, mayonnaise, apple cider vinegar, ground paprika, ground white pepper, sugar, and celery seed together with garlic mixture until dressing reaches a uniform consistency. Pour dressing over shredded cabbage and toss to evenly coat. Press coleslaw down into the bowl using the back of a spoon or place another bowl on top. Cover and refrigerate for at least 1 hour. Stir before serving.",182 calories; protein 1.8g; carbohydrates 8.2g; fat 16.5g; cholesterol 3.5mg; sodium 433.6mg.
https://www.allrecipes.com/recipe/81108/classic-macaroni-salad/,Classic Macaroni Salad Recipe,20 mins,10 mins,4 hrs,4 hrs 30 mins,10,10 servings,"4 cups uncooked elbow macaroni, 1 cup mayonnaise, ¼ cup distilled white vinegar, ⅔ cup white sugar, 2 ½ tablespoons prepared yellow mustard, 1 ½ teaspoons salt, ½ teaspoon ground black pepper, 1 large onion, chopped, 2 stalks celery, chopped, 1 green bell pepper, seeded and chopped, ¼ cup grated carrot (Optional), 2 tablespoons chopped pimento peppers (Optional)","Bring a large pot of lightly salted water to a boil. Add the macaroni, and cook until tender, about 8 minutes. Rinse under cold water and drain. In a large bowl, mix together the mayonnaise, vinegar, sugar, mustard, salt and pepper. Stir in the onion, celery, green pepper, carrot, pimentos and macaroni. Refrigerate for at least 4 hours before serving, but preferably overnight.",390 calories; protein 6.8g; carbohydrates 49.3g; fat 18.7g; cholesterol 8.4mg; sodium 528.6mg.
https://www.allrecipes.com/recipe/52734/awesome-pasta-salad/,Awesome Pasta Salad,30 mins,10 mins,,40 mins,16,16 servings,"1 (16 ounce) package fusilli (spiral) pasta, 3 cups cherry tomatoes, halved, ½ pound provolone cheese, cubed, ½ pound salami, cubed, ¼ pound sliced pepperoni, cut in half, 1 large green bell pepper, cut into 1 inch pieces, 1 (10 ounce) can black olives, drained, 1 (4 ounce) jar pimentos, drained, 1 (8 ounce) bottle Italian salad dressing","Bring a large pot of lightly salted water to a boil. Add pasta, and cook for 8 to 10 minutes or until al dente. Drain, and rinse with cold water. In a large bowl, combine pasta with tomatoes, cheese, salami, pepperoni, green pepper, olives, and pimentos. Pour in salad dressing, and toss to coat.",310 calories; protein 12.9g; carbohydrates 25.9g; fat 17.7g; cholesterol 31.4mg; sodium 913.2mg.
https://www.allrecipes.com/recipe/142027/sweet-restaurant-slaw/,Sweet Restaurant Slaw Recipe,15 mins,,2 hrs,2 hrs 15 mins,8,8 servings,"1 (16 ounce) bag coleslaw mix, 2 tablespoons diced onion, ⅔ cup creamy salad dressing (such as Miracle Whip™), 3 tablespoons vegetable oil, ½ cup white sugar, 1 tablespoon white vinegar, ¼ teaspoon salt, ½ teaspoon poppy seeds","Combine the coleslaw mix and onion in a large bowl. Whisk together the salad dressing, vegetable oil, sugar, vinegar, salt, and poppy seeds in a medium bowl; blend thoroughly. Pour dressing mixture over coleslaw mix and toss to coat. Chill at least 2 hours before serving.",200 calories; protein 0.8g; carbohydrates 22.5g; fat 12g; cholesterol 11.2mg; sodium 252.5mg.
https://www.allrecipes.com/recipe/238423/dads-creamy-cucumber-salad/,Dad's Creamy Cucumber Salad Recipe,10 mins,,2 hrs,2 hrs 10 mins,8,,"2 large cucumbers, peeled and thinly sliced, 1 sweet onion, thinly sliced, 1 tablespoon sea salt, 1 ½ cups mayonnaise, or more to taste, 2 tablespoons vinegar, 1 tablespoon white sugar, 1 teaspoon dried dill weed, 1 teaspoon garlic powder, 1 teaspoon ground black pepper","Mix cucumbers, onion, and salt together in a bowl. Cover with plastic wrap and let sit for 15 to 30 minutes. Turn cucumber mixture into a colander set over a bowl or in a sink. Let drain, stirring occasionally, until most of the liquid and salt has drained, 15 to 30 minutes. Transfer drained cucumber mixture to a large bowl. Whisk mayonnaise, vinegar, sugar, dill, garlic powder, and pepper for dressing together in a bowl until smooth. Pour over cucumber mixture and stir until coated. Cover with plastic wrap and refrigerate for 1 to 2 hours before serving.",320 calories; protein 1.1g; carbohydrates 6.9g; fat 32.9g; cholesterol 15.7mg; sodium 896.9mg.
https://www.allrecipes.com/recipe/11752/italian-confetti-pasta-salad/,Italian Confetti Pasta Salad Recipe,,,,,6,6 servings,"1 cup mayonnaise, 1 tablespoon red wine vinegar, 1 teaspoon salt, ¼ teaspoon ground black pepper, 1 clove garlic, minced, 1 ½ tablespoons chopped fresh basil, 2 cups colored rotini pasta, 1 cup chopped tomatoes, ½ cup chopped yellow bell pepper, ½ cup sliced black olives","Cook pasta according to package directions. Rinse in cold water, and drain. In a large mixing bowl, whisk together mayonnaise, vinegar, salt, black pepper, and garlic until well blended. Mix in basil. Add pasta, tomatoes, bell peppers, and olives; fold gently until mixed. Chill several hours. Stir gently before serving.",354 calories; protein 3.4g; carbohydrates 17.7g; fat 30.9g; cholesterol 13.9mg; sodium 702.4mg.
https://www.allrecipes.com/recipe/222218/nanas-southern-coleslaw/,Nana's Southern Coleslaw Recipe,20 mins,,2 hrs,2 hrs 20 mins,8,8 servings,"1 head cabbage, finely shredded, 2 carrots, finely chopped, 2 tablespoons finely chopped onion, ½ cup mayonnaise, ⅓ cup white sugar, ¼ cup milk, ¼ cup buttermilk, 2 tablespoons lemon juice, 2 tablespoons distilled white vinegar, ½ teaspoon salt, ⅛ teaspoon ground black pepper","Mix cabbage, carrots, and onion in a large salad bowl. Whisk mayonnaise, sugar, milk, buttermilk, lemon juice, vinegar, salt, and black pepper in a separate bowl until smooth and the sugar has dissolved. Pour dressing over cabbage mixture and mix thoroughly. Cover bowl and refrigerate slaw at least 2 hours (the longer the better). Mix again before serving.",184 calories; protein 2.7g; carbohydrates 20.3g; fat 11.3g; cholesterol 6.1mg; sodium 273.7mg.
https://www.allrecipes.com/recipe/52047/adriennes-cucumber-salad/,Adrienne's Cucumber Salad Recipe,,,,,8,8 servings,"4 cucumbers, thinly sliced, 1 small white onion, thinly sliced, 1 cup white vinegar, ½ cup water, ¾ cup white sugar, 1 tablespoon dried dill, or to taste","Toss together the cucumbers and onion in a large bowl. Combine the vinegar, water and sugar in a saucepan over medium-high heat. Bring to a boil, and pour over the cucumber and onions. Stir in dill, cover, and refrigerate until cold. This can also be eaten at room temperature, but be sure to allow the cucumbers to marinate for at least 1 hour.",99 calories; protein 1.1g; carbohydrates 24.9g; fat 0.2g; sodium 4.4mg.
https://www.allrecipes.com/recipe/18517/napa-cabbage-salad/,Napa Cabbage Salad Recipe,15 mins,15 mins,,30 mins,6,6 servings,"1 head napa cabbage, 1 bunch minced green onions, ⅓ cup butter, 1 (3 ounce) package ramen noodles, broken, 2 tablespoons sesame seeds, 1 cup slivered almonds, ¼ cup cider vinegar, ¾ cup vegetable oil, ½ cup white sugar, 2 tablespoons soy sauce","Finely shred the head of cabbage; do not chop. Combine the green onions and cabbage in a large bowl, cover and refrigerate until ready to serve. Preheat oven to 350 degrees F (175 degrees C). Make the crunchies: Melt the butter in a pot. Mix the ramen noodles, sesame seeds and almonds into the pot with the melted butter. Spoon the mixture onto a baking sheet and bake the crunchies in the preheated 350 degrees F (175 degrees C) oven, turning often to make sure they do not burn. When they are browned remove them from the oven. Make the dressing: In a small saucepan, heat vinegar, oil, sugar, and soy sauce. Bring the mixture to a boil, let boil for 1 minute. Remove the pan from heat and let cool. Combine dressing, crunchies, and cabbage immediately before serving. Serve right away or the crunchies will get soggy.",632 calories; protein 9.2g; carbohydrates 39.8g; fat 51.3g; cholesterol 27.1mg; sodium 652.5mg.
https://www.allrecipes.com/recipe/23445/rainbow-pasta-salad-ii/,Rainbow Pasta Salad II Recipe,15 mins,10 mins,1 hr,1 hr 25 mins,8,8 servings,"1 (16 ounce) package tri-colored pasta assortment, 2 large tomatoes, diced, 1 large cucumber, peeled and diced, 1 red onion, finely chopped, 1 (16 ounce) bottle Italian-style salad dressing","Bring a large pot of lightly salted water to a boil. Add pasta and cook for 8 to 10 minutes or until al dente; drain and rinse in cold water. In a large bowl combine tomatoes, cucumbers, onion, cooled pasta and Italian dressing. Refrigerate overnight, or for at least 1 hour.",387 calories; protein 8.3g; carbohydrates 51.7g; fat 16.7g; sodium 924mg.
https://www.allrecipes.com/recipe/14151/marinated-cherry-tomato-salad/,Marinated Cherry Tomato Salad,10 mins,,2 hrs,2 hrs 10 mins,7,6 to 8 servings,"4 cups halved cherry tomatoes, ¼ cup vegetable oil, 3 tablespoons cider vinegar, 1 teaspoon dried parsley, 1 teaspoon dried basil, 1 teaspoon dried oregano, ½ teaspoon salt, 1 ½ teaspoons white sugar","In a small bowl or cup measure, mix together oil, apple cider vinegar, herbs, salt, and sugar. Pour dressing over cherry tomatoes in a serving dish, and gently stir to coat. Chill for at least 2 hours. Gently stir from bottom to top, coating all tomatoes, before serving.",94 calories; protein 0.8g; carbohydrates 5.2g; fat 8.2g; sodium 174.5mg.
https://www.allrecipes.com/recipe/15925/creamy-au-gratin-potatoes/,Creamy Au Gratin Potatoes Recipe,30 mins,1 hr 30 mins,,2 hrs,4,4 servings,"4 russet potatoes, sliced into 1/4 inch slices, 1 onion, sliced into rings, salt and pepper to taste, 3 tablespoons butter, 3 tablespoons all-purpose flour, ½ teaspoon salt, 2 cups milk, 1 ½ cups shredded Cheddar cheese","Preheat oven to 400 degrees F (200 degrees C). Butter a medium casserole dish. Layer 1/2 of the potatoes into bottom of the prepared casserole dish. Top with the onion slices, and add the remaining potatoes. Season with salt and pepper to taste. In a medium-size saucepan, melt butter over medium heat. Mix in the flour and salt, and stir constantly with a whisk for one minute. Stir in milk. Cook until mixture has thickened. Stir in cheese all at once, and continue stirring until melted, about 30 to 60 seconds. Pour cheese over the potatoes, and cover the dish with aluminum foil. Bake 1 1/2 hours in the preheated oven.",499 calories; protein 19.8g; carbohydrates 49.3g; fat 25.4g; cholesterol 77.2mg; sodium 683.4mg.
https://www.allrecipes.com/recipe/44975/easy-pizza-sauce-iii/,Easy Pizza Sauce Recipe,5 mins,,,5 mins,24,2 3/4 cups,"1 (15 ounce) can tomato sauce, 1 (6 ounce) can tomato paste, 1 tablespoon ground oregano, 1 ½ teaspoons dried minced garlic, 1 teaspoon ground paprika","Mix together tomato sauce and tomato paste in a medium bowl until smooth. Stir in oregano, garlic, and paprika.",11 calories; protein 0.6g; carbohydrates 2.6g; fat 0.1g; sodium 147.8mg.
https://www.allrecipes.com/recipe/159374/byrdhouse-blistered-cherry-tomatoes/,Byrdhouse Blistered Cherry Tomatoes Recipe,5 mins,5 mins,,10 mins,4,4 servings,"2 teaspoons butter, 1 teaspoon dried basil, 1 pint cherry tomatoes, ½ teaspoon white sugar, salt and pepper to taste","Melt butter in a skillet over medium-high heat. Add the cherry tomatoes, basil, and sugar. Cook for about 30 seconds, then season to taste with salt and pepper. Continue cooking for a few seconds more until the tomatoes have just started to blister.",36 calories; protein 0.7g; carbohydrates 4.1g; fat 2.3g; cholesterol 5.4mg; sodium 21.2mg.
https://www.allrecipes.com/recipe/275060/creamy-garlic-parmesan-mashed-potatoes/,Creamy Garlic-Parmesan Mashed Potatoes Recipe,30 mins,20 mins,,50 mins,10,10 servings,"5 pounds potatoes, peeled and quartered, ¼ cup butter, 6 cloves garlic, minced, 2 cups 2% milk, 1 cup freshly grated Parmesan cheese, ¼ cup chopped fresh parsley, 1 teaspoon sea salt, ½ teaspoon ground black pepper","Place potatoes into a large pot and cover with salted water; bring to a boil. Reduce heat to medium-low and simmer until tender, 20 to 25 minutes. While potatoes are cooking, melt butter over medium-low heat in a small saucepan. Add garlic and saute until soft, about 5 minutes. Drain potatoes and return to the pot. Add garlic-butter mixture, milk, Parmesan cheese, parsley, sea salt, and pepper; mash until smooth.",278 calories; protein 9.5g; carbohydrates 43g; fat 8.1g; cholesterol 23.1mg; sodium 365.8mg.
https://www.allrecipes.com/recipe/239180/greek-style-lemon-roasted-potatoes/,Greek-Style Lemon Roasted Potatoes Recipe,15 mins,1 hr,,1 hr 15 mins,6,,"3 pounds potatoes, peeled and cut into thick wedges, ⅓ cup olive oil, 2 lemons, juiced, 2 teaspoons salt, 1 teaspoon oregano, ½ teaspoon ground black pepper, 3 cups chicken broth","Preheat the oven to 400 degrees F (200 degrees C). Put potato wedges in a large bowl. Drizzle with olive oil and lemon juice and toss to coat. Season with salt, oregano, and black pepper; toss again to coat. Spread potato wedges in a single layer in a 2-inch-deep pan. Pour chicken broth over potatoes. Roast potatoes in the preheated oven until tender and golden brown, about 1 hour.",282 calories; protein 4.6g; carbohydrates 39.9g; fat 12.2g; sodium 789.1mg.
https://www.allrecipes.com/recipe/146100/lemon-parsley-green-beans/,Lemon-Parsley Green Beans,5 mins,11 mins,,16 mins,4,4 servings,"1 pinch white sugar, 1 pound fresh green beans, trimmed, 2 tablespoons butter, 2 teaspoons olive oil, 3 cloves garlic, minced, 1 tablespoon lemon zest, ¼ cup chopped fresh parsley, salt and pepper to taste, 1 lemon, cut into wedges","Bring a large pot of salted water to a boil over high heat: add sugar, and beans. Cook until beans are bright green and tender, 3 to 5 minutes. Drain, and place in a large bowl of ice water to stop cooking. Combine the butter and olive oil in a large skillet over medium-high heat; cook until butter melts. Stir in the garlic; cook until pale beige and fragrant. Stir in the beans; cook until wilted, and garlic is dark brown, about 4 minutes. Toss beans with parsley and lemon zest, and cook 1 to 2 minutes more. Season to taste with salt and pepper. Transfer beans to a serving dish, and garnish with lemon wedges.",119 calories; protein 2.7g; carbohydrates 12.5g; fat 8.4g; cholesterol 15.3mg; sodium 51.1mg.
https://www.allrecipes.com/recipe/214931/oven-roasted-asparagus/,Oven-Roasted Asparagus Recipe,10 mins,15 mins,,25 mins,4,4 servings,"1 bunch thin asparagus spears, trimmed, 3 tablespoons olive oil, 1 ½ tablespoons grated Parmesan cheese (Optional), 1 clove garlic, minced (Optional), 1 teaspoon sea salt, ½ teaspoon ground black pepper, 1 tablespoon lemon juice (Optional)","Preheat an oven to 425 degrees F (220 degrees C). Place the asparagus into a mixing bowl, and drizzle with the olive oil. Toss to coat the spears, then sprinkle with Parmesan cheese, garlic, salt, and pepper. Arrange the asparagus onto a baking sheet in a single layer. Bake in the preheated oven until just tender, 12 to 15 minutes depending on thickness. Sprinkle with lemon juice just before serving.",123 calories; protein 3.3g; carbohydrates 5.2g; fat 10.8g; cholesterol 1.7mg; sodium 471.4mg.
https://www.allrecipes.com/recipe/240784/easy-coleslaw-dressing/,Easy Coleslaw Dressing Recipe,5 mins,,,5 mins,6,6 servings,"½ cup mayonnaise, 2 tablespoons white sugar, 1 ½ tablespoons lemon juice, 1 tablespoon vinegar, ½ teaspoon ground black pepper, ¼ teaspoon salt","Whisk mayonnaise, sugar, lemon juice, vinegar, pepper, and salt together in a bowl until smooth and creamy.",94 calories; protein 0.2g; carbohydrates 9.3g; fat 6.5g; cholesterol 5.1mg; sodium 236.2mg.
