recipe_link,name,prep,cook,additional,total,servings,yield,ingredients,instructions,nutrition
https://www.allrecipes.com/recipe/222037/tater-tots-r-casserole/,Tater Tots Casserole Recipe,10 mins,30 mins,,40 mins,8,8 servings,"1 pound ground beef, 1 pinch salt and ground black pepper to taste, 1 (10.75 ounce) can condensed cream of mushroom soup, 2 cups shredded Cheddar cheese, 1 (16 ounce) package frozen tater tots","Preheat oven to 350 degrees F (175 degrees C). Cook and stir ground beef in a large skillet over medium heat until no longer pink and completely browned, 7 to 10 minutes; season with salt and black pepper. Stir cream of mushroom soup into the cooked ground beef; pour the mixture into a 9x13-inch baking dish. Layer tater tots evenly over the ground beef mixture; top with Cheddar cheese. Bake until tater tots are golden brown and hot, 30 to 45 minutes.",345 calories; protein 18.5g; carbohydrates 16.9g; fat 23.8g; cholesterol 65.1mg; sodium 700.2mg.
https://www.allrecipes.com/recipe/9401/salmon-patties-i/,Salmon Patties I Recipe,15 mins,10 mins,,25 mins,5,4 to 6 servings,"1 (14.75 ounce) can canned salmon, 1 egg, ¼ cup chopped onion, ½ cup seasoned dry bread crumbs, 1 tablespoon olive oil","Drain and reserve liquid from salmon. Mix egg, onion, bread crumbs and salmon together. Make into patties. If mixture is too dry to form into patties, add reserved liquid from salmon. In a frying pan, heat olive oil. Place patties in pan. Brown on each side, turning gently. Drain on paper towels and serve.",224 calories; protein 22.3g; carbohydrates 9g; fat 10.4g; cholesterol 73.7mg; sodium 522.8mg.
https://www.allrecipes.com/recipe/268249/italian-baked-meatballs/,Italian Baked Meatballs Recipe,20 mins,30 mins,,50 mins,6,30 1-ounce meatballs,"1 cup Italian-seasoned bread crumbs, ¼ cup grated Romano cheese, 2 tablespoons chopped fresh parsley, ½ teaspoon salt, ½ teaspoon ground black pepper, ½ teaspoon garlic powder, ½ teaspoon onion powder, ½ cup water, 2 eggs, 1 ½ pounds ground beef","Preheat the oven to 350 degrees F (175 degrees C). Mix bread crumbs, Romano cheese, parsley, salt, pepper, garlic powder, and onion powder together. Combine with water and eggs. Add ground beef and mix well. Roll mixture into balls and place on a nonstick baking sheet. Bake in the preheated oven until browned, about 30 minutes.",343 calories; protein 24.4g; carbohydrates 14.1g; fat 20.4g; cholesterol 135.2mg; sodium 611.7mg.
https://www.allrecipes.com/recipe/228823/quick-beef-stir-fry/,Quick Beef Stir-Fry Recipe,15 mins,10 mins,,25 mins,4,4 servings,"2 tablespoons vegetable oil, 1 pound beef sirloin, cut into 2-inch strips, 1 ½ cups fresh broccoli florets, 1 red bell pepper, cut into matchsticks, 2 carrots, thinly sliced, 1 green onion, chopped, 1 teaspoon minced garlic, 2 tablespoons soy sauce, 2 tablespoons sesame seeds, toasted","Heat vegetable oil in a large wok or skillet over medium-high heat; cook and stir beef until browned, 3 to 4 minutes. Move beef to the side of the wok and add broccoli, bell pepper, carrots, green onion, and garlic to the center of the wok. Cook and stir vegetables for 2 minutes. Stir beef into vegetables and season with soy sauce and sesame seeds. Continue to cook and stir until vegetables are tender, about 2 more minutes.",268 calories; protein 22.6g; carbohydrates 9.1g; fat 15.8g; cholesterol 48.9mg; sodium 526.2mg.
https://www.allrecipes.com/recipe/17841/sopp/,S.O.P.P. Recipe,20 mins,25 mins,,45 mins,5,4 to 6 servings,"2 tablespoons vegetable oil, 6 potatoes - peeled and cubed, 2 pounds smoked sausage, sliced, 1 onion, sliced, 2 green bell peppers, chopped","Heat oil in a large skillet over medium heat. Place the potatoes in the skillet, cover and simmer, turning occasionally, until potatoes are almost tender and a little browned, about 10 minutes. Stir in the sausage, onion and peppers. Cover and cook for about 5 more minutes, or until onion and peppers are to desired tenderness.",970 calories; protein 46.1g; carbohydrates 52.7g; fat 63.4g; cholesterol 123.5mg; sodium 2741.6mg.
https://www.allrecipes.com/recipe/221286/traditional-mexican-guacamole/,Traditional Mexican Guacamole Recipe,10 mins,,,10 mins,4,4 servings,"2 avocados, peeled and pitted, 1 cup chopped tomatoes, ¼ cup chopped onion, ¼ cup chopped cilantro, 2 tablespoons lemon juice, 1 jalapeno pepper, seeded and minced (Optional), salt and ground black pepper to taste","Mash avocados in a bowl until creamy. Mix tomatoes, onion, cilantro, lemon juice, and jalapeno pepper into mashed avocado until well combined; season with salt and black pepper.",177 calories; protein 2.7g; carbohydrates 12.2g; fat 14.9g; sodium 49.9mg.
https://www.allrecipes.com/recipe/14811/creamy-dill-cucumber-toasties/,Creamy Dill Cucumber Toasties Recipe,15 mins,,,15 mins,12,1 1/2 cups,"1 (8 ounce) package cream cheese, softened, 1 (.7 ounce) package dry Italian-style salad dressing mix, ½ cup mayonnaise, 1 French baguette, cut into 1/2 inch thick circles, 1 cucumber, sliced, 2 teaspoons dried dill weed","In a medium bowl, mix together cream cheese, dressing mix and mayonnaise. Spread a thin layer of the cream cheese mixture on a slice of bread, and top with a slice of cucumber. Sprinkle with dill. Repeat with remaining ingredients.",247 calories; protein 6.1g; carbohydrates 23.7g; fat 14.5g; cholesterol 24mg; sodium 619mg.
https://www.allrecipes.com/recipe/73135/homestyle-potato-chips/,Homestyle Potato Chips Recipe,40 mins,20 mins,,1 hr,8,,"4 medium potatoes, peeled and sliced paper-thin, 3 tablespoons salt, plus more to taste, 1 quart oil for deep frying","Transfer potato slices to a large bowl of cold water as you slice them. Drain slices and rinse under cold water. Refill the bowl with water, add 3 tablespoons salt, and put slices back in the bowl. Let potatoes soak in the salty water for at least 30 minutes. Drain and rinse slices again. Pat dry. Heat oil in a deep-fryer to 365 degrees F (185 degrees C). Working in small batches, fry potato slices until golden. Remove with a slotted spoon and drain on paper towels. Continue until all of the slices are fried. Season potato chips with additional salt if desired.",179 calories; protein 2.2g; carbohydrates 18.6g; fat 11.1g; sodium 2622.6mg.
https://www.allrecipes.com/recipe/223491/fully-loaded-deviled-eggs/,Fully Loaded Deviled Eggs Recipe,15 mins,15 mins,2 hrs,2 hrs 30 mins,24,24 deviled egg halves,"12 eggs, 1 teaspoon vegetable oil, 1 small onion, chopped, ¼ cup sour cream, 2 tablespoons mayonnaise, 1 tablespoon ranch dressing, or to taste, 1 ½ teaspoons Dijon mustard, ½ teaspoon garlic powder, ½ pinch onion powder, ⅛ teaspoon lemon pepper seasoning, 1 tablespoon bacon bits, or to taste, 1 cup finely shredded sharp Cheddar cheese, ¼ teaspoon paprika, or as needed","Place eggs into a large pot and cover with lightly salted water. Bring to a boil and reduce heat to medium; boil eggs for 10 to 12 minutes. Drain boiling water and fill the pot with cold water. Let eggs sit in cold water for 2 minutes, then pour off water and replace with more cold water. Repeat until eggs are thoroughly chilled, 10 to 15 minutes. Peel eggs; set aside. Heat vegetable oil in a small skillet over medium heat; cook and stir onion until translucent, about 5 minutes. Remove from heat and let cool. Slice eggs in half lengthwise and scoop yolks into a bowl; transfer egg white halves to a plate. Mash egg yolks with a fork; stir in sour cream, mayonnaise, ranch dressing, Dijon mustard, garlic powder, onion powder, and lemon pepper seasoning until yolk mixture is smooth. Stir in sautéed onions, bacon bits, and Cheddar cheese. Generously fill egg halves with filling and sprinkle each deviled egg with paprika. Refrigerate until chilled before serving.",76 calories; protein 4.6g; carbohydrates 0.8g; fat 6g; cholesterol 99.8mg; sodium 97.6mg.
https://www.allrecipes.com/recipe/69225/strawberry-bruschetta/,Strawberry Bruschetta Recipe,10 mins,5 mins,,15 mins,12,12 servings,"24 slices French baguette, 1 tablespoon butter, softened, 2 cups chopped fresh strawberries, ¼ cup white sugar, or as needed","Preheat your oven's broiler. Spread a thin layer of butter on each slice of bread. Arrange bread slices in a single layer on a large baking sheet. Place bread under the broiler for 1 to 2 minutes, just until lightly toasted. Spoon some chopped strawberries onto each piece of toast, then sprinkle sugar over the strawberries. Place under the broiler again until sugar is caramelized, 3 to 5 minutes. Serve immediately.",120 calories; protein 3.7g; carbohydrates 23.1g; fat 1.6g; cholesterol 2.5mg; sodium 202.1mg.
https://www.allrecipes.com/recipe/213849/caprese-on-a-stick/,Caprese on a Stick Recipe,15 mins,,,15 mins,8,16 skewers,"1 pint cherry tomatoes, halved, 1 (.6 ounce) package fresh basil leaves, 1 (16 ounce) package small fresh mozzarella balls, toothpicks, 3 tablespoons olive oil, salt and pepper to taste","Thread a tomato half, a small piece of basil leaf, and a mozzarella ball onto toothpicks until all ingredients are used. Drizzle the olive oil over the tomato, cheese and basil, leaving the end of the toothpick clean. Sprinkle with salt and pepper. Serve immediately.",215 calories; protein 10.5g; carbohydrates 3g; fat 17.4g; cholesterol 44.6mg; sodium 84.7mg.
https://www.allrecipes.com/recipe/284069/air-fried-bacon-wrapped-shrimp/,Air-Fried Bacon-Wrapped Shrimp Recipe,10 mins,7 mins,25 mins,42 mins,4,4 servings,"16 jumbo Shrimp, fresh, raw, jumbo (11-15), ¾ teaspoon Cajun seasoning, 8 strips thin sliced bacon, cut in half, 16 toothpicks, 2 tablespoons hot honey (such as Mike's Hot Honey®)","Place shrimp on a plate and sprinkle both sides with Cajun seasoning. Wrap each shrimp with 1 narrow strip of bacon and fasten with a toothpick. Refrigerate for 25 to 30 minutes. Preheat the air fryer to 400 degrees F (200 degrees C). Air-fry shrimp for 3 minutes. Flip and continue cooking until bacon is lightly crispy, 4 to 5 minutes more. You may have to do 2 batches depending on the size of your air fryer. Remove shrimp to a plate and drizzle with hot honey. Serve immediately, being watchful of any toothpicks.",241 calories; protein 29.8g; carbohydrates 9.1g; fat 8.9g; cholesterol 233.4mg; sodium 761.4mg.
https://www.allrecipes.com/recipe/256882/dill-pickle-dip/,Dill Pickle Dip Recipe,15 mins,,1 hr,1 hr 15 mins,12,1 1/2 cup,"1 (8 ounce) package cream cheese, at room temperature, 1 cup chopped dill pickles, or more to taste, ¼ cup finely chopped sweet onion, 2 tablespoons pickle juice, or more to taste, 1 teaspoon dried dill weed, ½ teaspoon kosher salt, 1 pinch freshly ground black pepper, or to taste","Stir cream cheese in a bowl with a wooden spoon until smooth. Stir in dill pickles, onion, pickle juice, dill weed, salt, and pepper until evenly distributed. Refrigerate before serving, at least 1 hour.",69 calories; protein 1.5g; carbohydrates 1.4g; fat 6.5g; cholesterol 20.5mg; sodium 288.4mg.
https://www.allrecipes.com/recipe/270257/zucchini-parmesan-cheese-fritters/,Zucchini-Parmesan Cheese Fritters Recipe,15 mins,10 mins,10 mins,35 mins,10,10 fritters,"3 large zucchini, finely grated, ½ teaspoon salt, 1 egg, 5 tablespoons all-purpose flour, 4 tablespoons Parmesan cheese, ¼ teaspoon salt, ground black pepper to taste, oil for frying, 1 tablespoon grated Parmesan cheese, or to taste, 1 pinch salt, ¼ cup sour cream, for topping","Combine zucchini and salt in a bowl and stir to combine. Set aside for 10 minutes. Pour mixture onto a clean dish towel or cheesecloth and squeeze to drain completely. Whisk egg in a bowl and add flour, Parmesan cheese, salt, and pepper. Stir in drained zucchini and mix well. Heat oil in a medium-sized pan over medium-high heat. Add batter by the tablespoon. Cook fritters until golden brown on both sides, about 5 minutes per batch. Transfer to a serving plate and sprinkle with Parmesan cheese and salt. Serve immediately with sour cream.",138 calories; protein 3.4g; carbohydrates 6.7g; fat 11.4g; cholesterol 23.3mg; sodium 248mg.
https://www.allrecipes.com/recipe/223197/cinco-de-mayo-salsa-cruda/,Cinco de Mayo Salsa Cruda,20 mins,,15 mins,35 mins,4,2 cups salsa,"1 ½ pounds cherry or grape tomatoes, diced, ½ cup finely diced onion, 1 jalapeno chile peppers, seeded and minced, 1 serrano chile pepper, seeded and minced, 2 cloves garlic, minced, 2 tablespoons lime juice, ¼ teaspoon dried oregano, 1 pinch cayenne pepper, or more to taste, 1 teaspoon salt, or to taste, 1 pinch white sugar, 2 tablespoons minced fresh mint leaves, ½ bunch fresh cilantro, chopped, salt to taste","Drain tomatoes in a strainer for 15 minutes. Combine tomatoes, onion, jalapeno pepper, serrano pepper, and garlic in a large bowl. Pour lime juice over the top. Stir in oregano, cayenne pepper, salt, sugar, mint, and cilantro. Refrigerate for 1 hour. Season with salt to taste.",48 calories; protein 2.1g; carbohydrates 10.6g; fat 0.5g; sodium 594.5mg.
https://www.allrecipes.com/recipe/39643/baby-blt/,Baby BLT Recipe,20 mins,10 mins,1 hr,1 hr 30 mins,24,,"1 pound bacon, cooked and crumbled, ½ cup mayonnaise, ¼ cup green onions, chopped, 2 tablespoons chopped fresh parsley, 24 cherry tomatoes","Place bacon in a large, deep skillet. Cook over medium-high heat for 6 to 8 minutes, or until evenly brown. Once cooled, crumble and set aside. In a bowl, stir together mayonnaise, bacon, green onions, and parsley until well blended. Set aside. Cut a small slice from the top of each tomato. Using a melon baller or small spoon, scoop out the inside of each tomato and discard. Fill each tomato with the bacon mixture, and refrigerate for 1 hour. Serve chilled.",71 calories; protein 2.5g; carbohydrates 1.1g; fat 6.3g; cholesterol 8.6mg; sodium 172.1mg.
https://www.allrecipes.com/recipe/215701/grilled-jalapeno-poppers/,Grilled Jalapeno Poppers,30 mins,30 mins,,1 hr,16,16 stuffed jalapenos,"8 ounces cream cheese, 2 tablespoons grated Parmesan cheese, 1 ½ teaspoons garlic powder, 1 ½ cups shredded Cheddar cheese, 16 whole jalapeno peppers with stems, 8 slices bacon, cut in half crosswise","Preheat an outdoor grill for medium heat, and lightly oil the grate. Mix together the cream cheese, Parmesan cheese, garlic powder, and Cheddar cheese in a bowl until the mixture is thoroughly blended. Lay a jalapeno pepper onto a work surface, and cut a lengthwise sliver from the side of the pepper, exposing the seeds and white membrane. With the handle of a teaspoon, scrape out the seeds and membrane, leaving the hollow pepper. Repeat for the rest of the peppers. Chop up the pepper slices, and mix into the cheese stuffing. Stuff each pepper with cheese mixture, and wrap each stuffed pepper in a half bacon slice. Secure with toothpicks. Grill the poppers on a less-hot part of the grill until the peppers are hot and juicy and the bacon is browned, 30 to 40 minutes.",164 calories; protein 5.8g; carbohydrates 1.6g; fat 15g; cholesterol 36.8mg; sodium 234.1mg.
https://www.allrecipes.com/recipe/176957/baked-kale-chips/,Baked Kale Chips Recipe,10 mins,20 mins,,30 mins,6,6 servings,"1 bunch kale, 1 tablespoon olive oil, 1 teaspoon flaked sea salt","Preheat an oven to 300 degrees F (150 degrees C). Line a rimmed baking sheet with parchment paper. With a knife or kitchen shears carefully remove kale leaves from the thick stems and tear into bite size pieces. Wash and thoroughly dry kale with a salad spinner. Drizzle kale leaves with olive oil and toss to combine. Spread out in an even layer on the baking sheet without overlapping and sprinkle with salt. Bake until the edges start to brown but are not burnt, 20 to 30 minutes.",58 calories; protein 2.5g; carbohydrates 7.6g; fat 2.8g; sodium 185.1mg.
https://www.allrecipes.com/recipe/233603/bacon-wrapped-jalapeno-poppers/,Bacon-Wrapped Jalapeno Poppers Recipe,15 mins,25 mins,,40 mins,6,12 appetizers,"½ cup cream cheese, ½ cup shredded sharp Cheddar cheese, 12 jalapeno peppers, halved lengthwise, seeds and membranes removed, 12 slices bacon","Preheat oven to 400 degrees F (200 degrees C). Line a baking sheet with aluminum foil. Mix cream cheese and Cheddar cheese together in a bowl until evenly blended. Fill each jalapeno half with the cheese mixture. Put halves back together and wrap each stuffed pepper with a slice of bacon. Arrange bacon-wrapped peppers on the prepared baking sheet. Bake in the preheated oven until bacon is crispy, 25 to 35 minutes.",213 calories; protein 11g; carbohydrates 2.5g; fat 17.7g; cholesterol 51.3mg; sodium 539.5mg.
https://www.allrecipes.com/recipe/213608/garlic-aioli/,Garlic Aioli Recipe,10 mins,,30 mins,40 mins,8,1 cup,"¾ cup mayonnaise, 3 cloves garlic, minced, 2 ½ tablespoons lemon juice, ¾ teaspoon salt, ½ teaspoon ground black pepper","Mix mayonnaise, garlic, lemon juice, salt, and pepper in a bowl. Cover and refrigerate for at least 30 minutes before serving.",151 calories; protein 0.3g; carbohydrates 1.5g; fat 16.4g; cholesterol 7.8mg; sodium 335.5mg.
https://www.allrecipes.com/recipe/24239/vietnamese-fresh-spring-rolls/,Vietnamese Fresh Spring Rolls Recipe,45 mins,5 mins,,50 mins,8,8 spring rolls,"2 ounces rice vermicelli, 8 rice wrappers (8.5 inch diameter), 8 large cooked shrimp - peeled, deveined and cut in half, 1 ⅓ tablespoons chopped fresh Thai basil, 3 tablespoons chopped fresh mint leaves, 3 tablespoons chopped fresh cilantro, 2 leaves lettuce, chopped, 4 teaspoons fish sauce, ¼ cup water, 2 tablespoons fresh lime juice, 1 clove garlic, minced, 2 tablespoons white sugar, ½ teaspoon garlic chili sauce, 3 tablespoons hoisin sauce, 1 teaspoon finely chopped peanuts","Bring a medium saucepan of water to boil. Boil rice vermicelli 3 to 5 minutes, or until al dente, and drain. Fill a large bowl with warm water. Dip one wrapper into the hot water for 1 second to soften. Lay wrapper flat. In a row across the center, place 2 shrimp halves, a handful of vermicelli, basil, mint, cilantro and lettuce, leaving about 2 inches uncovered on each side. Fold uncovered sides inward, then tightly roll the wrapper, beginning at the end with the lettuce. Repeat with remaining ingredients. In a small bowl, mix the fish sauce, water, lime juice, garlic, sugar and chili sauce. In another small bowl, mix the hoisin sauce and peanuts. Serve rolled spring rolls with the fish sauce and hoisin sauce mixtures.",82 calories; protein 3.3g; carbohydrates 15.8g; fat 0.7g; cholesterol 10.8mg; sodium 305.4mg.
https://www.allrecipes.com/recipe/15184/mouth-watering-stuffed-mushrooms/,Mouth-Watering Stuffed Mushrooms Recipe,25 mins,20 mins,,45 mins,12,12 large mushrooms,"12 whole fresh mushrooms, 1 tablespoon vegetable oil, 1 tablespoon minced garlic, 1 (8 ounce) package cream cheese, softened, ¼ cup grated Parmesan cheese, ¼ teaspoon ground black pepper, ¼ teaspoon onion powder, ¼ teaspoon ground cayenne pepper","Preheat oven to 350 degrees F (175 degrees C). Spray a baking sheet with cooking spray. Clean mushrooms with a damp paper towel. Carefully break off stems. Chop stems extremely fine, discarding tough end of stems. Heat oil in a large skillet over medium heat. Add garlic and chopped mushroom stems to the skillet. Fry until any moisture has disappeared, taking care not to burn garlic. Set aside to cool. When garlic and mushroom mixture is no longer hot, stir in cream cheese, Parmesan cheese, black pepper, onion powder and cayenne pepper. Mixture should be very thick. Using a little spoon, fill each mushroom cap with a generous amount of stuffing. Arrange the mushroom caps on prepared cookie sheet. Bake for 20 minutes in the preheated oven, or until the mushrooms are piping hot and liquid starts to form under caps.",88 calories; protein 2.7g; carbohydrates 1.5g; fat 8.2g; cholesterol 22mg; sodium 81.8mg.
https://www.allrecipes.com/recipe/223597/old-fashioned-potato-cakes/,Old Fashioned Potato Cakes Recipe,10 mins,10 mins,,20 mins,4,4 servings,"2 cups mashed potatoes, 1 cup all-purpose flour, 1 onion, diced, 1 egg, ½ teaspoon ground black pepper, ½ teaspoon salt, ½ cup vegetable oil, or as needed","Mix mashed potatoes, flour, onion, egg, black pepper, and salt together in a bowl until batter consistency. Heat vegetable oil in a skillet over medium heat. Drop 4-inch circles of batter into hot oil. Cook until golden brown, about 5 minutes per side. Remove with a slotted spoon and drain on paper towels. Repeat with remaining batter.",255 calories; protein 7.1g; carbohydrates 45.1g; fat 4.9g; cholesterol 48.6mg; sodium 627.1mg.
https://www.allrecipes.com/recipe/203800/pico-de-gallo/,Pico de Gallo Recipe,20 mins,,,20 mins,12,3 cups,"6 roma (plum) tomatoes, diced, ½ red onion, minced, 3 tablespoons chopped fresh cilantro, ½ jalapeño pepper, seeded and minced, ½ lime, juiced, 1 clove garlic, minced, 1 pinch garlic powder, 1 pinch ground cumin, or to taste, salt and ground black pepper to taste","Stir tomatoes, onion, cilantro, jalapeño pepper, lime juice, garlic, garlic powder, cumin, salt, and pepper together in a bowl.",10 calories; protein 0.4g; carbohydrates 2.2g; fat 0.1g; sodium 15.2mg.
https://www.allrecipes.com/recipe/14064/easy-guacamole/,Easy Guacamole Recipe,10 mins,,30 mins,40 mins,16,2 cups,"2 avocados, 1 small onion, finely chopped, 1 clove garlic, minced, 1 ripe tomato, chopped, 1 lime, juiced, salt and pepper to taste","Peel and mash avocados in a medium serving bowl. Stir in onion, garlic, tomato, lime juice, salt and pepper. Season with remaining lime juice and salt and pepper to taste. Chill for half an hour to blend flavors.",45 calories; protein 0.7g; carbohydrates 3.4g; fat 3.7g; sodium 2.4mg.
https://www.allrecipes.com/recipe/24509/grandmas-famous-salmon-cakes/,Grandma's Famous Salmon Cakes Recipe,10 mins,20 mins,,30 mins,4,8 salmon cakes,"1 (14.75 ounce) can salmon, drained and flaked, 2 large eggs, beaten, 1 small onion, diced, 1 teaspoon ground black pepper, 3 tablespoons vegetable oil","Pick through salmon to remove any bones or large pieces of skin. Beat eggs in a mixing bowl. Stir in salmon, onion, and black pepper. Mix thoroughly. Shape salmon mixture into eight 2-ounce patties. Heat oil in a large skillet over medium heat. Fry patties until crispy and golden brown on the outsides, about 5 minutes per side; work in batches if necessary to avoid crowding the pan.",307 calories; protein 27.5g; carbohydrates 2.3g; fat 20.3g; cholesterol 138.4mg; sodium 407.5mg.
https://www.allrecipes.com/recipe/222795/superb-sauteed-mushrooms/,Superb Sauteed Mushrooms Recipe,10 mins,15 mins,,25 mins,4,4 servings,"3 tablespoons olive oil, 3 tablespoons butter, 1 pound button mushrooms, sliced, 1 clove garlic, thinly sliced, 1 tablespoon red cooking wine, 1 tablespoon teriyaki sauce, or more to taste, ¼ teaspoon garlic salt, or to taste, freshly ground black pepper to taste","Heat olive oil and butter in a large saucepan over medium heat. Cook and stir mushrooms, garlic, cooking wine, teriyaki sauce, garlic salt, and black pepper in the hot oil and butter until mushrooms are lightly browned, about 5 minutes. Reduce heat to low and simmer until mushrooms are tender, 5 to 8 more minutes.",199 calories; protein 3.9g; carbohydrates 5.3g; fat 19.2g; cholesterol 22.9mg; sodium 375.7mg.
https://www.allrecipes.com/recipe/23596/fried-mozzarella-cheese-sticks/,Fried Mozzarella Cheese Sticks Recipe,15 mins,10 mins,,25 mins,8,,"2 large eggs, beaten, ¼ cup water, 1 ½ cups Italian seasoned bread crumbs, ½ teaspoon garlic salt, ⅔ cup all-purpose flour, ⅓ cup cornstarch, 2 cups oil for frying, or as needed, 1 (16 ounce) package mozzarella cheese sticks","Whisk water and eggs together in a small bowl. Mix bread crumbs and garlic salt together in a medium bowl. Blend flour and cornstarch together in a third bowl. Heat oil to 365 degrees F (185 degrees C) in a large, heavy saucepan. Dredge a mozzarella stick in flour; shake off excess. Dip into egg mixture. Lift up so excess egg drips back in the bowl. Press into bread crumbs to coat. Place breaded mozzarella stick on a plate or wire rack. Repeat with remaining mozzarella sticks. Use a spider spoon or a pair of tongs to lower 3 to 4 mozzarella sticks into the hot oil. Fry until golden brown, about 30 seconds. Remove from heat and drain on paper towels. Repeat to fry remaining mozzarella sticks.",789 calories; protein 19.4g; carbohydrates 29.5g; fat 66.5g; cholesterol 82.8mg; sodium 805.5mg.
https://www.allrecipes.com/recipe/187822/baked-chicken-wings/,Baked Chicken Wings Recipe,10 mins,1 hr,,1 hr 10 mins,2,10 wings,"3 tablespoons olive oil, 3 cloves garlic, pressed, 2 teaspoons chili powder, 1 teaspoon garlic powder, salt and ground black pepper to taste, 10 chicken wings","Preheat the oven to 375 degrees F (190 degrees C). Combine the olive oil, garlic, chili powder, garlic powder, salt, and pepper in a large, resealable bag; seal and shake to combine. Add the chicken wings; reseal and shake to coat. Arrange the chicken wings on a baking sheet. Cook the wings in the preheated oven 1 hour, or until crisp and cooked through.",532 calories; protein 31.7g; carbohydrates 3.9g; fat 43.1g; cholesterol 96.6mg; sodium 122.6mg.
