recipe_link,name,prep,cook,additional,total,servings,yield,ingredients,instructions,nutrition
https://www.allrecipes.com/recipe/241260/taco-tuesday-casserole/,Taco Tuesday Casserole Recipe,15 mins,30 mins,,45 mins,8,8 servings,"cooking spray, 2 pounds ground beef, ½ cup diced onion, 1 ½ cups water, 9 tablespoons taco seasoning mix, 5 flour tortillas, 1 (10 ounce) can whole kernel corn, drained, 2 cups shredded Cheddar cheese, 8 corn tortilla chips, or more to taste, ¼ cup diced tomatoes, or to taste (Optional), 2 tablespoons chopped olives, or to taste (Optional)","Preheat oven to 350 degrees F (175 degrees C). Spray a 9x13-inch baking dish with cooking spray. Heat a large skillet over medium-high heat. Cook and stir beef in the hot skillet until almost browned and crumbly, about 5 minutes. Add onion; cook and stir until beef is browned and onion is softened, about 5 minutes more. Mix water and taco seasoning into beef mixture; simmer until water evaporates, about 5 minutes. Line the prepared baking dish with tortillas and top with 1/2 of the ground beef mixture. Spoon 1/2 of the corn over the beef layer and top with 1/3 of the Cheddar cheese. Crush tortilla chips over cheese layer. Repeat layers with remaining ingredients, ending with Cheddar cheese, tomatoes, and olives. Bake in the preheated oven until heated through and cheese is melted, 15 to 20 minutes.",556 calories; protein 31.2g; carbohydrates 33.2g; fat 32.2g; cholesterol 105.9mg; sodium 1295.1mg.
https://www.allrecipes.com/recipe/40399/the-best-meatballs/,The Best Meatballs Recipe,30 mins,20 mins,,50 mins,8,8 servings,"1 pound ground beef, ½ pound ground veal, ½ pound ground pork, 2 cloves garlic, minced, 2 eggs, 1 cup freshly grated Romano cheese, 1 ½ tablespoons chopped Italian flat leaf parsley, salt and ground black pepper to taste, 2 cups stale Italian bread, crumbled, 1 ½ cups lukewarm water, 1 cup olive oil","Combine beef, veal, and pork in a large bowl. Add garlic, eggs, cheese, parsley, salt and pepper. Blend bread crumbs into meat mixture. Slowly add the water 1/2 cup at a time. The mixture should be very moist but still hold its shape if rolled into meatballs. (I usually use about 1 1/4 cups of water). Shape into meatballs. Heat olive oil in a large skillet. Fry meatballs in batches. When the meatball is very brown and slightly crisp remove from the heat and drain on a paper towel. (If your mixture is too wet, cover the meatballs while they are cooking so that they hold their shape better.)",613 calories; protein 26.6g; carbohydrates 6.6g; fat 53.2g; cholesterol 148.6mg; sodium 333.1mg.
https://www.allrecipes.com/recipe/18074/marinated-flank-steak/,Marinated Flank Steak Recipe,10 mins,10 mins,2 hrs 5 mins,2 hrs 25 mins,6,,"½ cup vegetable oil, ⅓ cup low-sodium soy sauce, ¼ cup red wine vinegar, 2 tablespoons fresh lemon juice, 1 ½ tablespoons Worcestershire sauce, 1 tablespoon Dijon mustard, 2 cloves garlic, minced, ½ teaspoon ground black pepper, 1 (1 1/2-pound) flank steak","Whisk together oil, soy sauce, vinegar, lemon juice, Worcestershire sauce, Dijon mustard, garlic, and pepper for marinade in a 9x13-inch glass baking dish until thoroughly combined. Add flank steak to the baking dish; turn several times to coat thoroughly with marinade. Cover, and refrigerate for 2 to 6 hours, or up to 12 hours if you have time. When ready to cook, preheat an outdoor grill for medium-high heat and lightly oil the grate. Remove steak from the marinade and shake off excess. Discard the remaining marinade. Cook steak on the preheated grill for about 5 minutes per side, or to desired doneness. Remove from the grill and let rest for 5 minutes before slicing and serving.",363 calories; protein 24.5g; carbohydrates 3.5g; fat 27.6g; cholesterol 45.8mg; sodium 638mg.
https://www.allrecipes.com/recipe/268091/easy-korean-ground-beef-bowl/,Easy Korean Ground Beef Bowl Recipe,10 mins,15 mins,,25 mins,4,4 bowls,"1 pound lean ground beef, 5 cloves garlic, crushed, 1 tablespoon freshly grated ginger, 2 teaspoons toasted sesame oil, ½ cup reduced-sodium soy sauce, ⅓ cup light brown sugar, ¼ teaspoon crushed red pepper, 6 green onions, chopped, divided, 4 cups hot cooked brown rice, 1 tablespoon toasted sesame seeds","Heat a large skillet over medium-high heat. Add beef and cook, stirring and crumbling into small pieces until browned, 5 to 7 minutes. Drain excess grease. Stir in garlic, ginger, and sesame oil and cook until fragrant, about 2 minutes. Stir in soy sauce, brown sugar, and red pepper. Cook until beef absorbs some sauce, about 7 minutes. Add 1/2 of chopped green onions. Serve over hot cooked rice; garnish with sesame seeds and remaining green onions.",574 calories; protein 28.8g; carbohydrates 70.3g; fat 19.1g; cholesterol 74.3mg; sodium 1142.2mg.
https://www.allrecipes.com/recipe/150306/the-best-chicken-fried-steak/,The Best Chicken Fried Steak Recipe,20 mins,20 mins,,40 mins,4,,"4 (1/2 pound) beef cube steaks, 2 ¼ cups all-purpose flour, divided, 2 teaspoons baking powder, 1 teaspoon baking soda, 1 teaspoon black pepper, ¾ teaspoon salt, 1 ½ cups buttermilk, 1 tablespoon hot pepper sauce (e.g. Tabasco™), 1 large egg, 2 cloves garlic, minced, 3 cups vegetable shortening for frying, 4 cups milk, kosher salt and ground black pepper to taste","Place steaks between 2 layers of plastic and pound to a thickness of 1/4 inch. Place 2 cups flour in a shallow bowl. Stir together baking powder, baking soda 1 teaspoon pepper, and 3/4 teaspoon salt in second shallow bowl. Add buttermilk, Tabasco sauce, egg, and garlic; stir to combine. Heat shortening in a deep cast-iron skillet to 325 degrees F (165 degrees C). Place a wire rack over a sheet of parchment paper. While the shortening is heating, dredge a steak in flour to coat; shake off excess. Dip into buttermilk batter; lift up so excess batter drips back into the bowl. Press in flour again to coat both sides completely. Place breaded steak on the wire rack and repeat to bread remaining steaks. Fry steaks, in batches if necessary, until evenly golden brown, 3 to 5 minutes per side. Remove steaks to a paper towel-lined plate to drain. Cover with foil to keep warm while you make the gravy. Drain fat from the skillet, reserving 1/4 cup of the liquid and as much of the solid remnants as possible. Return the skillet to medium-low heat; add the reserved oil. Whisk the remaining 1/4 cup flour into the oil. Scrape the bottom of the pan with a spatula to release solids into the gravy. Stir in milk, increase the heat to medium, and bring the gravy to a simmer. Cook, stirring often, until thick, 6 to 7 minutes. Season with kosher salt and pepper. Transfer steaks to a platter and pour gravy over top.",832 calories; protein 68.2g; carbohydrates 71.1g; fat 28.6g; cholesterol 206.3mg; sodium 1273.4mg.
https://www.allrecipes.com/recipe/16346/maries-easy-slow-cooker-pot-roast/,Marie's Easy Slow Cooker Pot Roast Recipe,40 mins,9 hrs,,9 hrs 40 mins,8,6 to 8 servings,"4 pounds chuck roast, salt and pepper to taste, 1 packet dry onion soup mix, 1 cup water, 3 carrots, chopped, 1 onion, chopped, 3 potatoes, peeled and cubed, 1 stalk celery, chopped","Season the roast with salt and pepper to taste. Brown on all sides in a large skillet over high heat, about 4 minutes per side. Place the roast in the slow cooker and add the soup mix, water, carrots, onion, potatoes, and celery. Cover and cook on Low setting for 8 to 10 hours.",540 calories; protein 45.7g; carbohydrates 18.2g; fat 30.6g; cholesterol 147.4mg; sodium 271.9mg.
https://www.allrecipes.com/recipe/21353/italian-spaghetti-sauce-with-meatballs/,Italian Spaghetti Sauce with Meatballs Recipe,20 mins,2 hrs,,2 hrs 20 mins,6,6 servings,"1 pound lean ground beef, 1 cup fresh bread crumbs, 1 tablespoon dried parsley, 1 tablespoon grated Parmesan cheese, ¼ teaspoon ground black pepper, ⅛ teaspoon garlic powder, 1 egg, beaten, ¾ cup chopped onion, 5 cloves garlic, minced, ¼ cup olive oil, 2 (28 ounce) cans whole peeled tomatoes, 2 teaspoons salt, 1 teaspoon white sugar, 1 bay leaf, 1 (6 ounce) can tomato paste, ¾ teaspoon dried basil, ½ teaspoon ground black pepper","In a large bowl, combine ground beef, bread crumbs, parsley, Parmesan, 1/4 teaspoon black pepper, garlic powder and beaten egg. Mix well and form into 12 balls. Store, covered, in refrigerator until needed. In a large saucepan over medium heat, saute onion and garlic in olive oil until onion is translucent. Stir in tomatoes, salt, sugar and bay leaf. Cover, reduce heat to low, and simmer 90 minutes. Stir in tomato paste, basil, 1/2 teaspoon pepper and meatballs and simmer 30 minutes more.",347 calories; protein 18.9g; carbohydrates 23g; fat 21.2g; cholesterol 77.4mg; sodium 1492.5mg.
https://www.allrecipes.com/recipe/221958/chef-johns-perfect-prime-rib/,Chef John's Perfect Prime Rib Recipe,10 mins,2 hrs 20 mins,2 hrs,4 hrs 30 mins,4,4 servings,"1 (4 pound) prime rib roast, ¼ cup unsalted butter, softened, 1 tablespoon freshly ground black pepper, 1 teaspoon herbes de Provence, kosher salt to taste","Place prime rib roast on a plate and bring to room temperature, 2 to 4 hours. Preheat an oven to 500 degrees F (260 degrees C). Combine butter, pepper, and herbes de Provence in a bowl; mix until well blended. Spread butter mixture evenly over entire roast. Season roast generously with kosher salt. Roast the 4-pound roast in the preheated oven for 20 minutes. (If your roast is larger or smaller than 4 pounds, see footnote to calculate cooking time.) Turn oven off and, leaving the roast in the oven with the door closed, let the roast sit in the oven for 2 hours. Remove roast from the oven, slice, and serve.",1757 calories; protein 72.5g; carbohydrates 1g; fat 160.6g; cholesterol 361.6mg; sodium 342.7mg.
https://www.allrecipes.com/recipe/8395534/cheeseburger-bombs-with-bacon/,Cheeseburger Bombs with Bacon Recipe,15 mins,25 mins,,40 mins,16,16 cheeseburger bombs,"cooking spray, 16 ounces 80% lean ground beef, 3 slices bacon, chopped, ¼ cup minced onion, salt and freshly ground black pepper to taste, 3 tablespoons dill pickle relish, 3 tablespoons yellow mustard, 3 tablespoons BBQ sauce, 1 teaspoon garlic powder, 1 (16.3 ounce) package refrigerated biscuit dough (such as Pillsbury Grands!®), 5 ounces Cheddar cheese, 2 teaspoons sesame seeds, ⅓ cup ketchup","Preheat the oven to 375 degrees F (190 degrees C). Coat 16 cups of 2 muffin pans with cooking spray. Heat a large skillet over medium heat. Add ground beef, bacon, onion, salt, and pepper and cook, stirring, until beef is browned, about 6 minutes. Drain fat, and stir in dill pickle relish, mustard, BBQ sauce, and garlic powder. Set filling aside to cool. Separate each biscuit dough portion in half to get 16 biscuits, stretching and pulling each into a circle about 1/4 inch thick. Spoon about 2 tablespoons of the ground beef mixture into the center of each dough circle. Cut cheese into 16 cubes and insert each cube into the ground beef mixture. Wrap dough around the filling in the shape of a ball and pinch edges on the bottom together so biscuits are sealed around the filling. Set each biscuit seam side down in a muffin cup. Lightly spray the biscuit tops with cooking spray and sprinkle with sesame seeds. Bake in the preheated oven until golden brown, 15 to 20 minutes. Serve with ketchup for dipping on the side.",242 calories; fat 15.4g; cholesterol 34.4mg; sodium 548.8mg; carbohydrates 15.5g; protein 10.1g.
https://www.allrecipes.com/recipe/20680/easy-mexican-casserole/,Easy Mexican Casserole Recipe,20 mins,30 mins,,50 mins,6,1 9x13-inch casserole,"1 pound lean ground beef, 2 cups salsa, 1 (16 ounce) can chili beans, drained, 3 cups tortilla chips, crushed, 2 cups sour cream, 1 (2 ounce) can sliced black olives, drained, ½ cup chopped green onion, ½ cup chopped fresh tomato, 2 cups shredded Cheddar cheese","Preheat the oven to 350 degrees F (175 degrees C). Spray a 9x13-baking dish with cooking spray. Cook ground beef in a large skillet over medium-high heat until no longer pink, 8 to 10 minutes. Stir in salsa, reduce heat, and simmer until liquid is absorbed, about 20 minutes. Stir in beans; cook until heated through. Spread crushed tortilla chips in the baking dish, then spoon beef mixture on top. Spread sour cream over beef, then sprinkle olives, green onion, and tomato on top. Cover with Cheddar cheese. Bake in the preheated oven until hot and bubbly, about 30 minutes.",632 calories; protein 31.7g; carbohydrates 32.8g; fat 43.7g; cholesterol 119.2mg; sodium 1308.3mg.
https://www.allrecipes.com/recipe/8389572/mississippi-slugburger/,Mississippi Slugburger Recipe,15 mins,55 mins,,1 hr 10 mins,6,6 slugburgers,"7 slices potato bread, 1 pound ground chuck, 1 teaspoon kosher salt, ½ teaspoon freshly ground black pepper, ¼ teaspoon garlic powder, ¼ teaspoon onion powder, 1 cup vegetable oil for frying, or as needed, 6 hamburger buns, split, ¼ cup prepared yellow mustard, or to taste, ¼ cup dill pickle slices, or to taste, 1 pinch chili powder, or to taste (Optional), 1 pinch cayenne pepper, or to taste (Optional)","Preheat the oven to 175 degrees F (80 degrees C). Line a baking sheet with parchment paper. Cut the crusts off the bread slices. Place slices on the prepared baking sheet. Bake in the center of the preheated oven until dry and toasted, about 45 minutes. Transfer toasted bread to the bowl of a food processor and pulse until you reach coarse crumbs.   Place ground chuck, salt, pepper, garlic powder, and onion powder into a bowl. Add bread crumbs. Combine with your fingers, breaking apart the meat. Dampen your fingers with water and form mixture into hamburger patties. Heat ¼ to ½ inch vegetable oil in a skillet over medium-high heat. Place a patty into the pan and turn heat down to medium. Cook until well browned and crusty, 3 to 4 minutes per side. Repeat with remaining patties, adding more oil if needed. Remove from the pan and serve on hamburger buns with mustard and pickles; sprinkle tops of patties with chili powder and/or cayenne if you like prior to serving.  ",268 calories; fat 15.1g; cholesterol 54mg; sodium 735.8mg; carbohydrates 16.1g; protein 16.1g.
https://www.allrecipes.com/recipe/223538/jeffs-hot-dog-chili/,Jeff's Hot Dog Chili Recipe,10 mins,20 mins,,30 mins,6,,"1 pound ground beef, ⅓ cup water, ½ (10 ounce) can tomato sauce, ½ cup ketchup, 2 ½ teaspoons chili powder, ½ teaspoon salt, ½ teaspoon ground black pepper, ½ teaspoon white sugar, ½ teaspoon onion powder, 1 dash Worcestershire sauce","Place ground beef and water in a large saucepan; use a potato masher to break apart beef. Stir in tomato sauce, ketchup, chili powder, salt, black pepper, sugar, onion powder, and Worcestershire sauce. Bring to a boil, then cook over medium heat until beef is cooked and chili thickens, about 20 minutes.",168 calories; protein 13.6g; carbohydrates 7.5g; fat 9.4g; cholesterol 47.3mg; sodium 594.7mg.
https://www.allrecipes.com/recipe/240583/cheesy-ham-and-corn-chowder/,Cheesy Ham and Corn Chowder Recipe,25 mins,50 mins,,1 hr 15 mins,6,6 servings,"2 (15 ounce) cans chicken broth, ½ cup sliced carrots, 2 tablespoons chicken bouillon granules, 3 bay leaves, ½ teaspoon sea salt, ½ teaspoon ground black pepper, ½ teaspoon ground thyme, ½ teaspoon dried marjoram, ¼ teaspoon garlic powder, 1 cup peeled and diced potatoes, ½ cup chopped onion, ½ cup sliced celery, 3 tablespoons butter, 3 tablespoons all-purpose flour, 1 ½ cups milk, 1 (15 ounce) can cream-style corn, 1 (8 ounce) package shredded sharp Cheddar cheese, 1 cup diced cooked ham","Stir chicken broth, carrots, chicken bouillon, bay leaves, sea salt, pepper, thyme, marjoram, and garlic powder together in a Dutch oven; bring to a boil, reduce heat to medium, and cook for 10 minutes. Add potatoes and onion; cook for 10 minutes more. Add celery; cook until all vegetables are fork tender, about 10 minutes more. Melt butter in a saucepan over low heat. Remove from heat and whisk flour into butter until smooth. Return saucepan to medium heat; gradually add milk to butter mixture, whisking constantly, and cook until mixture thickens, 6 to 7 minutes. Stir milk mixture into vegetable mixture; add corn, Cheddar cheese, and ham, reduce heat to low, and simmer until ham is heated through and cheese melts, 10 to 15 minutes.",408 calories; protein 19.3g; carbohydrates 29.5g; fat 24.6g; cholesterol 75.7mg; sodium 2034.2mg.
https://www.allrecipes.com/recipe/245774/bucatini-allamatriciana/,Bucatini All'Amatriciana Recipe,10 mins,29 mins,,39 mins,2,2 servings,"5 ounces bucatini pasta, ¼ cup extra-virgin olive oil, 3 crushed garlic cloves, 1 ½ ounces guanciale (cured pork cheek), sliced, ¼ cup sliced red onion, 1 pinch red pepper flakes, ½ (8 ounce) can crushed San Marzano tomatoes, salt and ground black pepper to taste, 1 ounce freshly grated Pecorino Romano cheese","Fill a large pot with lightly salted water and bring to a rolling boil. Stir in bucatini and return to a boil. Cook, uncovered, stirring occasionally, until bucatini is tender, about 11 minutes. Drain. Heat oil in a large skillet over medium-high heat. Add garlic cloves; cook until golden brown, about 1 minute. Remove with a slotted spoon and discard. Add guanciale; cook and stir until crisp and golden, about 4 minutes. Add onion and red pepper flakes; cook and stir until onion is translucent, about 3 minutes. Stir in tomatoes, salt, and black pepper. Simmer tomato sauce until flavors combine, about 10 minutes. Stir bucatini and Pecorino Romano cheese into tomato sauce and toss until evenly coated.",634 calories; protein 17.3g; carbohydrates 60.1g; fat 35.9g; cholesterol 21.9mg; sodium 478.1mg.
https://www.allrecipes.com/recipe/262225/instant-pot-baby-back-ribs/,Instant Pot® Baby Back Ribs Recipe,10 mins,55 mins,5 mins,1 hr 10 mins,4,4 ribs,"2 tablespoons kosher salt, 1 tablespoon brown sugar, 1 tablespoon chili powder, 1 tablespoon paprika, 2 teaspoons garlic powder, 1 ½ teaspoons cayenne pepper, 1 teaspoon ground black pepper, 1 rack baby back pork ribs, 1 cup beef broth, ¼ cup barbeque sauce, or as needed","Combine kosher salt, brown sugar, chili powder, paprika, garlic powder, cayenne pepper, and black pepper in a small bowl for the spice rub. Cut the rack of ribs into 4 equal portions. Rub all sides of each piece with spice rub. Pour broth into a multi-functional pressure cooker (such as Instant Pot®). Add ribs in a teepee formation. Close and lock the lid. Select high pressure according to manufacturer's instructions; set timer for 30 minutes. Allow 10 to 15 minutes for pressure to build. Preheat the oven to 425 degrees F (220 degrees C). Line a baking sheet with aluminum foil. Release pressure carefully using the quick-release method according to manufacturer's instructions, about 5 minutes. Unlock and remove lid. Move ribs to the baking sheet using tongs. Brush ribs on all sides with barbeque sauce. Bake in the preheated oven for 7 minutes. Turn ribs and continue baking until meat pulls away easily from the bone, about 7 minutes more. An instant-read thermometer inserted into the center should read 145 degrees F (63 degrees C).",335 calories; protein 19.6g; carbohydrates 12.8g; fat 22.8g; cholesterol 87.6mg; sodium 3349.4mg.
https://www.allrecipes.com/recipe/14746/mushroom-pork-chops/,Mushroom Pork Chops Recipe,10 mins,30 mins,,40 mins,4,,"4 pork chops, salt and ground black pepper to taste, 1 pinch garlic salt, or to taste, ½ pound fresh mushrooms, sliced, 1 onion, chopped, 1 (10.75 ounce) can condensed cream of mushroom soup","Season pork chops with salt, pepper, and garlic salt. Brown chops over medium-high heat in a large nonstick skillet. Add mushrooms and onion and sauté for one minute. Pour soup over chops. Cover, reduce the heat to medium-low, and simmer until chops are cooked through, 20 to 30 minutes.",210 calories; protein 23.6g; carbohydrates 9.6g; fat 8.5g; cholesterol 64.9mg; sodium 924.3mg.
https://www.allrecipes.com/recipe/235378/super-easy-pulled-pork-sandwiches/,Super-Easy Pulled Pork Sandwiches Recipe,15 mins,9 hrs,,9 hrs 15 mins,20,20 servings,"3 tablespoons brown sugar, 3 tablespoons paprika, 1 ½ tablespoons garlic powder (such as McCormick® California Style), 1 ½ tablespoons ground black pepper, 1 ½ teaspoons salt, ½ cup Dijon mustard (such as Hellmann's®), 8 pounds pork shoulder roast (butt roast), rind removed, ½ cup barbeque sauce, or to taste, 18 large hamburger buns, split","Preheat oven to 250 degrees F (120 degrees C). Mix brown sugar, paprika, garlic powder, black pepper, and salt in a bowl. Spread mustard over pork roast and sprinkle with brown sugar mixture, using the entire amount. Line a shallow baking dish with aluminum foil. Place a rack in the prepared baking dish and arrange pork roast on rack. Bake in the preheated oven until very tender, 9 to 11 hours. Let pork cool, then shred into bite-size pieces. Stir barbeque sauce into pork to moisten; serve with hamburger buns.",414 calories; protein 30g; carbohydrates 44.9g; fat 11.7g; cholesterol 68.2mg; sodium 865.8mg.
https://www.allrecipes.com/recipe/216760/okinawa-shoyu-pork/,Okinawa Shoyu Pork Recipe,10 mins,1 hr 30 mins,,1 hr 40 mins,6,6 servings,"1 ½ pounds whole pork belly, ½ cup soy sauce, ½ cup packed brown sugar, ½ cup water, ½ cup mirin (Japanese sweet wine), 2 teaspoons ground ginger, 1 clove garlic, or to taste","Place pork belly into a large pot, and cover with water about 1-inch above the pork. Bring to a boil over medium-high heat, and simmer for 2 minutes. Discard water and fill pot with fresh water about 1-inch above the pork. Bring to a boil over medium-high heat, then reduce heat to a simmer. Cook until the pork begins to soften, about 1 hour. Remove the pork from the water, and place on a cutting board. Allow pork to cool for a few minutes, then slice off the thick skin and discard. Cut the remaining pork meat into 1-inch wide slices. Set aside. Combine the soy sauce, brown sugar, 1/2 cup water, mirin, ginger, and garlic in a large saucepan, and bring to a boil over high heat. Add the sliced pork belly, then bring to a boil again. Reduce heat to low, and place a sheet of aluminum foil directly over the meat and sauce. Simmer uncovered until the pork is tender, 30 to 45 minutes, turning the pork several times to cook evenly.",331 calories; protein 15.4g; carbohydrates 27g; fat 15.6g; cholesterol 41.1mg; sodium 2071mg.
https://www.allrecipes.com/recipe/139603/slow-cooker-carnitas/,Slow Cooker Carnitas Recipe,10 mins,10 hrs,,10 hrs 10 mins,10,10 servings,"1 teaspoon salt, 1 teaspoon garlic powder, 1 teaspoon ground cumin, ½ teaspoon crumbled dried oregano, ½ teaspoon ground coriander, ¼ teaspoon ground cinnamon, 1 (4 pound) boneless pork shoulder roast, 2 bay leaves, 2 cups chicken broth","Mix together salt, garlic powder, cumin, oregano, coriander, and cinnamon in a bowl. Coat pork with the spice mixture. Place the bay leaves in the bottom of a slow cooker and place the pork on top. Pour the chicken broth around the sides of the pork, being careful not to rinse off the spice mixture. Cover and cook on Low until the pork shreds easily with a fork, about 10 hours. Turn the meat after it has cooked for 5 hours. When the pork is tender, remove from slow cooker, and shred with two forks. Use cooking liquid as needed to moisten the meat.",223 calories; protein 22.2g; carbohydrates 0.7g; fat 13.8g; cholesterol 73.3mg; sodium 474.3mg.
https://www.allrecipes.com/recipe/237501/spam-fries-with-spicy-garlic-sriracha-dipping-sauce/,SPAM® Fries with Spicy Garlic Sriracha Dipping Sauce Recipe,15 mins,20 mins,20 mins,55 mins,8,8 servings,"1 clove garlic, minced, ½ teaspoon paprika, 1 pinch salt, 1 cup mayonnaise, 1 tablespoon sriracha sauce, 1 tablespoon ketchup, 1 quart vegetable oil for frying, 2 (12 ounce) cans fully cooked luncheon meat (such as SPAM®), sliced into fries","Process garlic, paprika, and salt in a food processor until smooth. Add mayonnaise, sriracha sauce, and ketchup; process until sauce is well-combined. Transfer sauce to a bowl, cover the bowl with plastic wrap, and refrigerate until chilled. Heat oil in a deep-fryer or large saucepan to 350 degrees F (175 degrees C). Rinse luncheon meat 'fries' with cool water and pat dry. Working in batches, cook 'fries' in preheated oil until browned and crispy on the outside and still moist on the inside, 4 to 6 minutes. Remove to a paper towel-lined plate. Transfer 'fries' to a plate and serve with chilled dipping sauce.",562 calories; protein 11.6g; carbohydrates 4.3g; fat 56g; cholesterol 69.9mg; sodium 1420.2mg.
