recipe_link,name,prep,cook,additional,total,servings,yield,ingredients,instructions,nutrition
https://www.allrecipes.com/recipe/158727/bacon-for-the-family-or-a-crowd/,Bacon for the Family or a Crowd Recipe,5 mins,15 mins,,20 mins,4,12 strips,1 pound thick sliced bacon,"Preheat the oven to 350 degrees F (175 degrees C). Line a baking sheet with aluminum foil. Arrange the bacon in a single layer on the prepared sheet with the edges touching or slightly overlapping. Bake in the preheated oven to desired degree of doneness, 10 to 15 minutes. Remove bacon from the baking sheet with tongs or a fork, and drain on a paper towel-lined plate.",203 calories; protein 13.9g; carbohydrates 0.5g; fat 15.6g; cholesterol 41.2mg; sodium 865.2mg.
https://www.allrecipes.com/recipe/236372/chef-johns-summer-scrambled-eggs/,Chef John's Summer Scrambled Eggs,5 mins,5 mins,,10 mins,1,1 serving,"3 large eggs, 1 pinch red pepper flakes, 9 cherry tomatoes, halved, 2 tablespoons crumbled feta cheese, 1 tablespoon very thinly sliced fresh basil leaves, olive oil, 1 pinch sea salt","Beat eggs and red pepper flakes together in a bowl. Stir tomatoes, feta, and basil leaves into egg mixture. Heat olive oil in a nonstick skillet over high heat until oil starts to shimmer. Pour egg mixture into hot oil and cook, without stirring, for 5 seconds. Cook and stir egg mixture until eggs are scrambled and softly set, about 30 seconds. Transfer eggs to a plate and sprinkle with sea salt.",420 calories; protein 23.1g; carbohydrates 9.7g; fat 33.1g; cholesterol 574.8mg; sodium 755.5mg.
https://www.allrecipes.com/recipe/20513/classic-waffles/,Classic Waffles Recipe,10 mins,15 mins,,25 mins,5,10 to 12 waffles,"2 cups all-purpose flour, 1 teaspoon salt, 4 teaspoons baking powder, 2 tablespoons white sugar, 2 eggs, 1 ½ cups warm milk, ⅓ cup butter, melted, 1 teaspoon vanilla extract","In a large bowl, mix together flour, salt, baking powder and sugar; set aside. Preheat waffle iron to desired temperature. In a separate bowl, beat the eggs. Stir in the milk, butter and vanilla. Pour the milk mixture into the flour mixture; beat until blended. Ladle the batter into a preheated waffle iron. Cook the waffles until golden and crisp. Serve immediately.",379 calories; protein 10.2g; carbohydrates 47.6g; fat 16.2g; cholesterol 112.8mg; sodium 899.1mg.
https://www.allrecipes.com/recipe/71803/quick-and-easy-home-fries/,Quick and Easy Home Fries Recipe,5 mins,20 mins,,25 mins,4,,"3 medium russet potatoes, cubed, 3 tablespoons butter or margarine, salt and ground black pepper to taste","Rinse potato cubes with cold water and drain well. Melt butter in a large skillet over medium heat. Place potatoes in the skillet and season with salt and pepper; mix well. Cover and cook for 10 minutes. Remove the lid and cook, turning frequently, until brown and crisp on all sides, about 10 more minutes.",199 calories; protein 3.3g; carbohydrates 27.9g; fat 8.8g; cholesterol 22.9mg; sodium 70.9mg.
https://www.allrecipes.com/recipe/150141/aunt-normas-rhubarb-muffins/,Aunt Norma's Rhubarb Muffins,15 mins,25 mins,10 mins,50 mins,24,2 dozen muffins,"2 ½ cups flour, 1 teaspoon baking soda, 1 teaspoon baking powder, ½ teaspoon salt, 1 ¼ cups brown sugar, ½ cup vegetable oil, 1 egg, 1 teaspoon vanilla extract, 1 cup buttermilk, 1 ½ cups diced rhubarb, ½ cup chopped walnuts, 1 tablespoon melted butter, ⅓ cup white sugar, 1 teaspoon ground cinnamon","Preheat the oven to 350 degrees F (175 degrees C). Grease two 12 cup muffin pans or line with paper cups. In a medium bowl, stir together the flour, baking soda, baking powder and salt. In a separate bowl, beat the brown sugar, oil, egg, vanilla and buttermilk with an electric mixer until smooth. Pour in the dry ingredients and mix by hand just until blended. Stir in the rhubarb and walnuts. Spoon the batter into the prepared cups, filling almost to the top. In a small bowl, stir together the melted butter, white sugar and cinnamon; sprinkle about 1 teaspoon of this mixture on top of each muffin. Bake in the preheated oven until the tops of the muffins spring back when lightly pressed, about 25 minutes. Cool in the pans for at least 10 minutes before removing.",157 calories; protein 2.4g; carbohydrates 21.5g; fat 7.1g; cholesterol 9.4mg; sodium 141mg.
https://www.allrecipes.com/recipe/281515/simple-southwestern-breakfast-pizza/,Simple Southwestern Breakfast Pizza,5 mins,20 mins,,25 mins,4,1 breakfast pizza,"3 pork sausage patties, 1 large flour tortilla, ½ cup shredded asadero cheese, divided, ⅓ cup salsa, 1 medium egg, 4 slices whole-wheat rotini or farfalle pasta, 1 tablespoon chopped fresh cilantro, or to taste, 1 tablespoon poblano peppers (about 1 1/4 pounds), 1 pinch freshly ground black pepper to taste","Preheat the oven to 350 degrees F (175 degrees C). Crumble sausage into a large skillet and cook until browned over medium-high heat, about 5 minutes. Drain grease and remove browned pork to a plate. Clean out skillet. Place flour tortilla into the skillet. Sprinkle 1/2 of the asadero cheese onto the tortilla and spread salsa over the cheese. Top with sausage crumbles and remaining cheese. Crack open the egg and carefully add to the middle of the pizza; cook for 12 minutes. Top pizza with avocado slices, chopped cilantro, crema con sal, and black pepper.",233 calories; protein 11g; carbohydrates 15.2g; fat 14.8g; cholesterol 77.7mg; sodium 467.4mg.
https://www.allrecipes.com/recipe/220520/classic-hash-browns/,Classic Hash Browns Recipe,10 mins,10 mins,,20 mins,2,2 servings,"2 russet potatoes, peeled, 3 tablespoons clarified butter, salt and ground black pepper to taste, 1 pinch cayenne pepper, or to taste, 1 pinch paprika, or to taste","Shred potatoes into a large bowl filled with cold water. Stir until water is cloudy, drain, and cover potatoes again with fresh cold water. Stir again to dissolve excess starch. Drain potatoes well, pat dry with paper towels, and squeeze out any excess moisture. Heat clarified butter in a large non-stick pan over medium heat. Sprinkle shredded potatoes into the hot butter and season with salt, black pepper, cayenne pepper, and paprika. Cook potatoes until a brown crust forms on the bottom, about 5 minutes. Continue to cook and stir until potatoes are browned all over, about 5 more minutes.",334 calories; protein 4.4g; carbohydrates 37.5g; fat 19.4g; cholesterol 49.2mg; sodium 13.4mg.
https://www.allrecipes.com/recipe/263600/instant-pot-paleo-and-keto-egg-shakshuka-with-kale/,Instant Pot® Paleo and Keto Egg Shakshuka with Kale Recipe,10 mins,15 mins,5 mins,30 mins,4,4 servings,"1 tablespoon olive oil, ½ onion, diced, ½ red bell pepper, diced, 2 cloves garlic, minced, 1 teaspoon chili powder, ½ teaspoon smoked paprika, ½ teaspoon ground cumin, 2 cups baby kale, 1 ½ cups marinara sauce, ½ teaspoon sea salt, ½ teaspoon ground black pepper, 4 eggs, 1 tablespoon chopped fresh parsley","Turn on a multi-functional pressure cooker (such as Instant Pot®) and select Saute function. Heat olive oil and cook onion, red bell pepper, garlic, chili powder, paprika, and cumin until soft, about 3 minutes. Add kale and cook until soft, about 2 minutes. Stir in marinara sauce and season with salt and pepper; turn off the pot and let cool for 5 minutes. Crack eggs carefully in the pot, evenly spaced. Close and lock the lid. Select low pressure according to manufacturer's instructions; set timer for 1 minute. Once it beeps, release pressure carefully using the quick-release method according to manufacturer's instructions, about 2 minutes. Unlock and remove the lid. Sprinkle with parsley.",205 calories; protein 8.5g; carbohydrates 19.6g; fat 10.7g; cholesterol 165.6mg; sodium 682mg.
https://www.allrecipes.com/recipe/14096/best-buckwheat-pancakes/,Best Buckwheat Pancakes Recipe,5 mins,10 mins,,15 mins,2,2 to 3 servings,"1 cup buttermilk, 1 egg, 3 tablespoons butter, melted, 6 tablespoons all-purpose flour, 6 tablespoons buckwheat flour, 1 teaspoon white sugar, ½ teaspoon salt, 1 teaspoon baking soda, 3 tablespoons butter","In a medium bowl, whisk together the buttermilk, egg, and melted butter. In another bowl, mix together white flour, buckwheat flour, sugar, salt and baking soda. Pour the dry ingredients into the egg-mixture. Stir until the two mixtures are just incorporated. Heat a griddle or large frying pan to medium-hot, and place 1 tablespoon of butter, margarine or oil into it. Let the butter melt before spooning the batter into the frying pan, form 4 inch pancakes out of the batter. Once bubbles form on the top of the pancakes, flip them over, and cook them on the other side for about 3 minutes. Continue with this process until all of the batter has been made into pancakes.",560 calories; protein 12.8g; carbohydrates 42.1g; fat 39g; cholesterol 189.5mg; sodium 1622.6mg.
https://www.allrecipes.com/recipe/267143/make-ahead-sweet-potato-and-chorizo-breakfast-burritos/,Make-Ahead Sweet Potato and Chorizo Breakfast Burritos Recipe,25 mins,25 mins,,50 mins,8,8 burritos,"2 medium sweet potatoes, scrubbed and cut into 1/2-inch cubes, 3 green onions, chopped, 2 tablespoons olive oil, ½ teaspoon garlic powder, ½ teaspoon salt, ¼ teaspoon ground black pepper, 1 (14 ounce) package Mexican-style chorizo, 1 tablespoon butter, 8 eggs, 8 (10 inch) flour tortillas, ½ cup salsa, 1 (4 ounce) package queso fresco, crumbled","Preheat the oven to 400 degrees F (200 degrees C). Line a baking sheet with parchment paper. Place sweet potatoes and green onions on the baking sheet. Drizzle with olive oil and sprinkle with garlic powder, salt, and pepper. Toss to combine and spread out evenly. Roast in the preheated oven until soft, about 25 minutes. Meanwhile, cook chorizo in a medium skillet over medium-high heat, breaking apart with a wooden spoon, 8 to 10 minutes. Drain any excess fat; transfer chorizo to a bowl and set aside to cool. Wipe out the skillet and return it to the stove. Whisk eggs in a bowl. Heat butter in the skillet over medium-high heat. Pour in eggs and scramble until just set, 3 to 5 minutes. Scrape eggs into a bowl and let cool. Line up tortillas in assembly-line fashion. Divide chorizo between the 8 tortillas. Top each with a portion of sweet potato-onion mixture, scrambled eggs, 1 tablespoon salsa, and queso fresco. Fold the bottom of each tortilla up over the filling, then fold in both sides and roll up burritos. Flip burritos so they are seam side-down. Wrap each individually with aluminum foil and place into a resealable plastic bag.",634 calories; protein 27g; carbohydrates 51g; fat 35.4g; cholesterol 238mg; sodium 1431.2mg.
https://www.allrecipes.com/recipe/21014/good-old-fashioned-pancakes/,Good Old Fashioned Pancakes Recipe,5 mins,15 mins,,20 mins,8,8 servings,"1 ½ cups all-purpose flour, 3 ½ teaspoons baking powder, ¼ teaspoon salt, or more to taste, 1 tablespoon white sugar, 1 ¼ cups milk, 1 egg, 3 tablespoons butter, melted","In a large bowl, sift together the flour, baking powder, salt and sugar. Make a well in the center and pour in the milk, egg and melted butter; mix until smooth. Heat a lightly oiled griddle or frying pan over medium-high heat. Pour or scoop the batter onto the griddle, using approximately 1/4 cup for each pancake. Brown on both sides and serve hot.",158 calories; protein 4.5g; carbohydrates 21.7g; fat 5.9g; cholesterol 37.7mg; sodium 503.6mg.
https://www.allrecipes.com/recipe/16383/basic-crepes/,Basic Crepes Recipe,10 mins,20 mins,,30 mins,4,8 crepes,"1 cup all-purpose flour, 2 eggs, ½ cup milk, ½ cup water, ¼ teaspoon salt, 2 tablespoons butter, melted","In a large mixing bowl, whisk together the flour and the eggs. Gradually add in the milk and water, stirring to combine. Add the salt and butter; beat until smooth. Heat a lightly oiled griddle or frying pan over medium high heat. Pour or scoop the batter onto the griddle, using approximately 1/4 cup for each crepe. Tilt the pan with a circular motion so that the batter coats the surface evenly. Cook the crepe for about 2 minutes, until the bottom is light brown. Loosen with a spatula, turn and cook the other side. Serve hot.",216 calories; protein 7.4g; carbohydrates 25.5g; fat 9.2g; cholesterol 110.7mg; sodium 235.3mg.
https://www.allrecipes.com/recipe/24571/caramelized-french-toast/,Caramelized French Toast Recipe,10 mins,20 mins,,30 mins,8,8 servings,"4 tablespoons butter, divided, 6 eggs, ½ cup milk, ⅛ teaspoon salt, 8 slices bread, 1 cup brown sugar, ½ cup water","Melt two tablespoons of butter in a frying pan or skillet over medium high heat. Beat together eggs, milk and salt. Dip bread one at a time into egg mixture and fry until light brown and egg is cooked. After 4 slices of bread have been cooked, melt remaining 2 tablespoons butter. Cook remaining bread slices until light brown on both sides and egg is cooked. After all bread slices have been cooked and removed from pan, add brown sugar to pan. Stir until melted and sticky. Add water and stir. Place French toast in caramel sauce. Turn to coat, then remove from pan. Serve.",248 calories; protein 7.2g; carbohydrates 31.4g; fat 10.6g; cholesterol 156mg; sodium 311.8mg.
https://www.allrecipes.com/recipe/258117/quick-crispy-home-fries/,Quick & Crispy Home Fries,10 mins,15 mins,20 mins,45 mins,2,2 servings,"3 large russet potatoes, peeled and quartered, 2 tablespoons olive oil, 1 tablespoon butter, Salt and freshly ground black pepper to taste, ¼ teaspoon paprika, cayenne pepper to taste, 1 pinch garlic powder, 1 pinch onion powder, 1 tablespoon Chopped fresh chives","Arrange potato pieces evenly on a microwave-safe plate. Microwave on high until just tender, about 4 minutes. Let cool to room temperature. Cut potatoes into bite-size chunks. Heat butter and olive oil in a non-stick skillet over medium-high heat. When butter melts and starts to turn brown, swirl the pan and add the potatoes. Shake pan to arrange in an even layer. Season with salt, pepper, paprika, garlic powder, and onion powder. As potatoes brown, toss them and keep turning them every few minutes until they are crusty and crispy-edged and a rich reddish-brown color, 10 to 12 minutes. If potatoes seem to be cooking too quickly, reduce heat to medium. Serve topped with chopped chives.",613 calories; protein 12.1g; carbohydrates 101.1g; fat 19.8g; cholesterol 15.3mg; sodium 146.9mg.
https://www.allrecipes.com/recipe/6698/moms-zucchini-bread/,Mom's Zucchini Bread Recipe,20 mins,1 hr,20 mins,1 hr 40 mins,24,2 loaves,"3 cups all-purpose flour, 1 teaspoon salt, 1 teaspoon baking soda, 1 teaspoon baking powder, 1 tablespoon ground cinnamon, 3 eggs, 1 cup vegetable oil, 2 ¼ cups white sugar, 3 teaspoons vanilla extract, 2 cups grated zucchini, 1 cup chopped walnuts","Grease and flour two 8 x 4 inch pans. Preheat oven to 325 degrees F (165 degrees C). Sift flour, salt, baking powder, soda, and cinnamon together in a bowl. Beat eggs, oil, vanilla, and sugar together in a large bowl. Add sifted ingredients to the creamed mixture, and beat well. Stir in zucchini and nuts until well combined. Pour batter into prepared pans. Bake for 40 to 60 minutes, or until tester inserted in the center comes out clean. Cool in pan on rack for 20 minutes. Remove bread from pan, and completely cool.",255 calories; protein 3.3g; carbohydrates 32.1g; fat 13.1g; cholesterol 23.3mg; sodium 179.8mg.
https://www.allrecipes.com/recipe/214947/perfect-summer-fruit-salad/,Perfect Summer Fruit Salad Recipe,25 mins,5 mins,3 hrs,3 hrs 30 mins,10,10 servings,"⅔ cup fresh orange juice, ⅓ cup fresh lemon juice, ⅓ cup packed brown sugar, ½ teaspoon grated orange zest, ½ teaspoon grated lemon zest, 1 teaspoon vanilla extract, 2 cups cubed fresh pineapple, 2 cups strawberries, hulled and sliced, 3 kiwi fruit, peeled and sliced, 3 bananas, sliced, 2 oranges, peeled and sectioned, 1 cup seedless grapes, 2 cups blueberries","Bring orange juice, lemon juice, brown sugar, orange zest, and lemon zest to a boil in a saucepan over medium-high heat. Reduce heat to medium-low, and simmer until slightly thickened, about 5 minutes. Remove from heat, and stir in vanilla extract. Set aside to cool. Layer the fruit in a large, clear glass bowl in this order: pineapple, strawberries, kiwi fruit, bananas, oranges, grapes, and blueberries. Pour the cooled sauce over the fruit. Cover and refrigerate for 3 to 4 hours before serving.",155 calories; protein 1.8g; carbohydrates 39g; fat 0.6g; sodium 4.7mg.
https://www.allrecipes.com/recipe/216756/baked-ham-and-cheese-party-sandwiches/,Baked Ham and Cheese Sliders Recipe,15 mins,20 mins,,35 mins,24,24 servings,"¾ cup melted butter, 1 ½ tablespoons Dijon mustard, 1 ½ teaspoons Worcestershire sauce, 1 ½ tablespoons poppy seeds, 1 tablespoon dried minced onion, 24 mini sandwich rolls, 1 pound thinly sliced cooked deli ham, 1 pound thinly sliced Swiss cheese","Preheat oven to 350 degrees F (175 degrees C). Grease a 9x13-inch baking dish. In a bowl, mix together butter, Dijon mustard, Worcestershire sauce, poppy seeds, and dried onion. Separate the tops from bottoms of the rolls, and place the bottom pieces into the prepared baking dish. Layer about half the ham onto the rolls. Arrange the Swiss cheese over the ham, and top with remaining ham slices in a layer. Place the tops of the rolls onto the sandwiches. Pour the mustard mixture evenly over the rolls. Bake in the preheated oven until the rolls are lightly browned and the cheese has melted, about 20 minutes. Slice into individual rolls through the ham and cheese layers to serve.",208 calories; protein 9.8g; carbohydrates 10.8g; fat 14g; cholesterol 43.4mg; sodium 439.2mg.
https://www.allrecipes.com/recipe/241707/joys-easy-banana-bread/,Joy's Easy Banana Bread Recipe,15 mins,1 hr,,1 hr 15 mins,10,1 9x5-inch loaf,"3 ripe bananas, mashed, 1 cup white sugar, 1 egg, ¼ cup melted butter, 1 ½ cups all-purpose flour, 1 teaspoon baking soda, 1 teaspoon salt","Preheat oven to 325 degrees F (165 degrees C). Grease a 9x5-inch loaf pan. Combine bananas, sugar, egg, and butter together in a bowl. Mix flour and baking soda together in a separate bowl; stir into banana mixture until batter is just mixed. Stir salt into batter. Pour batter into the prepared loaf pan. Bake in the preheated oven until a toothpick inserted in the center of the bread comes out clean, about 1 hour.",225 calories; protein 3g; carbohydrates 42.4g; fat 5.4g; cholesterol 30.8mg; sodium 398.8mg.
https://www.allrecipes.com/recipe/20334/banana-pancakes-i/,Banana Pancakes Recipe,5 mins,10 mins,,15 mins,6,12 pancakes,"1 cup all-purpose flour, 1 tablespoon white sugar, 2 teaspoons baking powder, ¼ teaspoon salt, 1 egg, beaten, 1 cup milk, 2 tablespoons vegetable oil, 2 ripe bananas, mashed","Combine flour, white sugar, baking powder, and salt in a bowl. Mix together egg, milk, vegetable oil, and bananas in a second bowl. Stir flour mixture into banana mixture; batter will be slightly lumpy. Heat a lightly oiled griddle or frying pan over medium high heat. Pour or scoop the batter onto the griddle, using approximately 1/4 cup for each pancake. Cook until pancakes are golden brown, 3 to 5 minutes per side. Serve hot.",193 calories; protein 5g; carbohydrates 29.2g; fat 6.6g; cholesterol 34.3mg; sodium 245.9mg.
https://www.allrecipes.com/recipe/162760/fluffy-pancakes/,Fluffy Pancakes Recipe,10 mins,10 mins,5 mins,25 mins,4,8 pancakes,"¾ cup milk, 2 tablespoons white vinegar, 1 cup all-purpose flour, 2 tablespoons white sugar, 1 teaspoon baking powder, ½ teaspoon baking soda, ½ teaspoon salt, 1 egg, 2 tablespoons butter, melted, cooking spray","Combine milk with vinegar in a medium bowl and set aside for 5 minutes to ""sour"". Combine flour, sugar, baking powder, baking soda, and salt in a large mixing bowl. Whisk egg and butter into ""soured"" milk. Pour the flour mixture into the wet ingredients and whisk until lumps are gone. Heat a large skillet over medium heat, and coat with cooking spray. Pour 1/4 cupfuls of batter onto the skillet, and cook until bubbles appear on the surface. Flip with a spatula, and cook until browned on the other side.",230 calories; protein 6.4g; carbohydrates 32.7g; fat 8.2g; cholesterol 65.4mg; sodium 649.6mg.
https://www.allrecipes.com/recipe/57783/emilys-famous-hash-browns/,Crispy Hash Browns Recipe,20 mins,15 mins,,35 mins,4,4 servings,"2 medium russet potatoes, shredded, ½ medium onion, finely chopped, ¼ cup all-purpose flour, 1 egg, 1 cup oil for frying, or as needed, salt and pepper to taste","Rinse shredded potatoes until water is clear, then drain and squeeze dry. Place shreds in a bowl and mix in the onion, flour, and egg until evenly distributed. Heat about 1/4 inch of oil in a large heavy skillet over medium-high heat. When oil is sizzling hot, place potatoes into the pan in a 1/2 inch thick layer. Cover the whole bottom of the pan, or make separate piles like pancakes. Cook until nicely browned on the bottom, then flip over and brown on the other side. It should take at least 5 minutes per side. If you are cooking them in one big piece, it can be cut into quarters for easier flipping. Remove from pan, and drain on paper towels. Season with salt and pepper and serve immediately.",183 calories; protein 4.7g; carbohydrates 26.1g; fat 6.9g; cholesterol 46.5mg; sodium 24.5mg.
https://www.allrecipes.com/recipe/222586/scrambled-egg-muffins/,Scrambled Egg Muffins Recipe,10 mins,20 mins,,30 mins,12,12 muffins,"½ pound bulk pork sausage, 12 eggs, ½ cup chopped onion, ½ cup chopped green bell pepper, or to taste, ½ teaspoon salt, ¼ teaspoon ground black pepper, ¼ teaspoon garlic powder, ½ cup shredded Cheddar cheese","Preheat the oven to 350 degrees F (175 degrees C). Lightly grease 12 muffin cups or line with paper muffin liners. Heat a large skillet over medium-high heat. Stir in sausage and cook until crumbly, evenly browned, and no longer pink, 10 to 15 minutes. Drain off grease. Beat eggs in a large bowl. Stir in onion, green pepper, salt, pepper, and garlic powder. Mix in sausage and Cheddar cheese. Spoon into the prepared muffin cups. Bake in the preheated oven until a knife inserted near the center comes out clean, 20 to 25 minutes.",143 calories; protein 10.2g; carbohydrates 1.6g; fat 10.6g; cholesterol 201.7mg; sodium 364.8mg.
https://www.allrecipes.com/recipe/221261/peanut-butter-banana-smoothie/,Peanut Butter Banana Smoothie Recipe,5 mins,,,5 mins,4,4 servings,"2 bananas, broken into chunks, 2 cups milk, ½ cup peanut butter, 2 tablespoons honey, or to taste, 2 cups ice cubes","Place bananas, milk, peanut butter, honey, and ice cubes in a blender; blend until smooth, about 30 seconds.",335 calories; protein 12.8g; carbohydrates 34.1g; fat 18.8g; cholesterol 9.8mg; sodium 202.8mg.
https://www.allrecipes.com/recipe/266642/egg-bites/,Egg Bites Recipe,20 mins,25 mins,,45 mins,12,12 egg bites,"cooking spray, 5 small tri-color baby potatoes, thinly sliced, ¼ stick butter, 10 small eggs, 1 small tomato, finely chopped, 1 small yellow bell pepper, finely chopped, ½ cup fresh spinach, ¼ cup chopped ham, ¼ cup chopped white onion, 1 slice mozzarella cheese, cut into 12 cubes","Preheat the oven to 350 degrees F (175 degrees C). Spray a 12-cup muffin tin with nonstick cooking spray. Place a thin layer of potato slices in the bottom of each muffin cup. Add a little butter on top. Bake in the preheated oven for 5 minutes. Mix eggs, tomato, bell pepper, spinach, ham, and onion together in a large bowl. Remove muffin tin from oven and ladle the egg mixture over the potatoes. Top each muffin cup with a mozzarella cube. Continue baking until egg bites are set, about 20 minutes.",108 calories; protein 6g; carbohydrates 8g; fat 6g; cholesterol 122.9mg; sodium 111.3mg.
https://www.allrecipes.com/recipe/272698/worlds-best-lemon-blueberry-muffins/,World's Best Lemon Blueberry Muffins Recipe,15 mins,30 mins,10 mins,55 mins,16,16 muffins,"3 ¼ cups all-purpose flour, 4 teaspoons baking powder, 1 teaspoon baking soda, ½ teaspoon salt, 1 ⅓ cups white sugar, 1 ¼ cups milk, 1 cup sour cream, ½ cup melted butter, 2 large eggs, 1 tablespoon lemon zest, 1 ½ cups frozen blueberries","Preheat the oven to 350 degrees F (175 degrees C). Line 16 muffin cups with paper liners. Sift flour, baking powder, baking soda, and salt together in a bowl. Combine sugar, milk, sour cream, butter, eggs, and lemon zest in a large bowl. Beat with an electric mixer on low speed until blended. Fold in the flour mixture until batter is just moistened. Fold in blueberries; avoid overmixing because batter will turn purple. Fill muffin cups 3/4 full of batter. Bake in the preheated oven until golden brown, 30 to 35 minutes. Let cool for 10 minutes.",265 calories; protein 4.6g; carbohydrates 39.7g; fat 10.1g; cholesterol 46.4mg; sodium 339mg.
https://www.allrecipes.com/recipe/272293/fluffy-microwave-scrambled-eggs/,Fluffy Microwave Scrambled Eggs Recipe,5 mins,5 mins,,10 mins,2,2 servings,"4 eggs, ¼ cup milk, ⅛ teaspoon salt","Break the eggs into a microwave-proof mixing bowl. Add milk and salt; mix well. Pop the bowl into the microwave and cook on high power for 30 seconds. Remove bowl, beat eggs very well, scraping down the sides of the bowl, and return to the microwave for another 30 seconds. Repeat this pattern, stirring every 30 seconds for up to 2 1/2 minutes. Stop when eggs have the consistency you desire.",141 calories; protein 12.1g; carbohydrates 2.1g; fat 9.3g; cholesterol 329.8mg; sodium 281mg.
